titles,category
경영승계 집중한 휴온스그룹  임원인사  변화 보다는  안정 ,Economic
  엔솔  퀄컴과  첨단 배터리관리 솔루션  상용화,Economic
 인적분할    리테일  거래재개 첫날      하락    피앤엘도     ,Economic
  월 들어서도 수출 증가세 역대최대  코앞  종합 ,Economic
신세계푸드      원 크리스마스 케이크  만 천개 판매 돌파,Economic
 업종 돋보기  운송 업종     년 흐름 전망은 ,Economic
금융위기 이후 사상 최고로 치솟은 환율 달러 강세 정통으로 맞았다,Economic
  기업인 최초 트럼프 만난 정용진  신세계 그룹 주가도  ,Economic
양자 컴퓨팅  생성형     인류 삶의 질 개선할   대 이슈는 ,Economic
   인플레 우려 덜었다  코스피  장초반     대 오름세 외국인 기관도  사자   투자    ,Economic
원수한테 권한다는  지주택  서울시    곳 조사해보니 부정행위가 무려,Economic
    출발  시간 전에 취소해야 위약금 없다    약관 개정,Economic
브래드피트도 새긴    타투  아직도 불법   이게 왜 의료행위냐 ,Economic
  운용        바이오     액티브      출시,Economic
빗썸  남산 서울타워에   미터 초대형  빗썸 트리  밝힌다,Economic
트럼프 만난 정용진  브로  후광에   사업 탄력받나,Economic
한전 누적적자 고려해   내년  분기 전기요금 동결,Economic
     두산공작기계  중국과 구체적 매각 협상 없었다   넘버스 ,Economic
 밑 빠진 독    플라자 유동성 위기 탈출 총력전          ,Economic
원 달러 환율      원 하락 출발   물가 안도 영향,Economic
 써보니 이 폰이 최고  구독자     만    유튜버  올해의 스마트폰 뽑았다,Economic
넷플릭스와 계약맺은      연이틀 상한가,Economic
 코인뉴스  비트코인  연말 휴일 앞두고 하락   상승세  주춤 ,Economic
구성역 플랫폼 시온시티    용인 민간임대 첫 지구단위계획안 결정 고시,Economic
 광주 화정 아이파크    센테니얼 로 재탄생      년 입주 목표,Economic
 올해의 드라마 배우   위  이 배우 가 화룡점정  내년 기대작에 목표가        투자    ,Economic
  중공업  해군 신형고속정  척 추가 수주     특수선 강자  재확인,Economic
비트코인 가격  만    달러로       하락 고점 대비     내렸다,Economic
광주 상무지구   판교 테크노밸리 급 개발  기대 ,Economic
  대한통운 택배기사 신속 대응  대형 화재 막았다 ,Economic
   파트너스    솔루션즈  중국 회사와 매각 협의 진행한 적 없어 ,Economic
차바이오텍       억 규모  주주 배정 유증에     급락,Economic
숭실대  정시     명 선발 자유전공학부    명 인문    명  자연    명  선발,Economic
             서    에이전트  에스더  출사표,Economic
내년 아파트 입주 물량     감소  년 만에 최저,Economic
     실리콘 야망   미완의 과제  모멘티브         실리콘이 이어받을까,Economic
코스피      선 거래 상승폭  확대   외국인 기관  사자 ,Economic
  엔솔  퀄컴과 맞손 첨단 배터리관리 솔루션 상용화 나선다,Economic
최상목   일 이후 단기유동성     조 공급 밸류업 펀드 신속 집행 ,Economic
아산탕정자이 퍼스트시티  순위 청약 최고 경쟁률       대  ,Economic
  중공업  해군 신형 고속정  척     억원에 수주,Economic
두산밥캣  수소지게차 상용화 이어 민간공급 첫 성공,Economic
  선박법 발의 소식에   조선업 강세 한화오션    상승 핫종목 ,Economic
        체제서    급성장 영향력 더 커질 것 ,Economic
수젠텍  프로메디젠에   억 투자  전략적 결정 ,Economic
 또 이사가야 하나  홍준표 의미심장 발언 테마주 급등,Economic
셀트리온  자가면역질환 치료제  앱토즈마주  국내 허가,Economic
카카오뱅크  주택담보대출 중도상환수수료  개월 연장,Economic
멈춘 집값 내년 상승 하락 변수는 ,Economic
한국콜마  종이로 만든 마스크팩 용기 개발  재활용 배출 가능 ,Economic
기아      국내생산 채비    월 광주서  설비공사  진행,Economic
나이벡  염증 섬유화 억제 펩타이드 기술 특허등록,Economic
교보생명   교보치매 간병안심보험  출시,Economic
팔란티어 안두릴 등 컨소시엄 구성해   국방사업 참여,Economic
   아문디         생성형   액티브      년 수익률     돌파 투자    ,Economic
레인보우로보틱스 이롭 차세대 복강경 수술 보조 로봇 개발 나서,Economic
현대엔지니어링  전농제 구역 재개발 수주,Economic
트럼프 만난 정용진 신세계그룹  동반  급등 ,Economic
빗썸   서울타워에 높이   미터 초대형 트리 조성,Economic
코스피  상승폭 확대  시도  반발매수세 유입에 사흘만에  반등 ,Economic
두산밥캣  수소지게차 첫 민간 공급  새 활로 열어,Economic
전기요금   분기도 동결    탄핵 정국에 요금 인상  제로  가능성,Economic
 사라진 산타랠리  비트코인     하락  억    만원대,Economic
광주 화정 아이파크   광주 센테니얼 아이파크 로   월 재시공,Economic
아시아나항공  새해에도 마일리지로 제주 다녀오세요 ,Economic
농심  서울의 겨울을 빛내다 서울빛초롱축제  라면놀이동산  화제,Economic
 단독  밸류업  차펀드 기관자금   일 납입 민간자금   월   억 그쳐  투자    ,Economic
삼성물산      억 규모 안양운동장 동측 재개발 수주,Economic
한국콜마  마스크팩 종이용기 개발  플라스틱     저감 ,Economic
대웅제약  펙수프라잔 브라질 수출 공급 계약 해지,Economic
정용진 회장 트럼프 만나자 신세계     상한가  신세계 그룹 도  불기둥   투자    ,Economic
지아이이노베이션   피하 주사 면역항암제  첫 환자 투약 완료,Economic
  중공업 신형 고속정  척 수주 함정 건조 기술력 인정,Economic
 혼란한 정국  내년  분기 전기요금 동결,Economic
국고채 보합권 출발 엇갈리는 재료 속에 혼조세,Economic
  반도체 보조금 확정에 삼성전자   하이닉스 상승 핫종목 ,Economic
  바이오사이언스 사노피  차세대 폐렴구균 백신 공동 개발 확장,Economic
안 추워서 안팔리는 패딩 어쩌나   백화점 패션업계  힘 합쳤다,Economic
오션뷰 숙소  만원대부터   가성비 호텔 최저가 챌린지 열린다,Economic
  에너지솔루션      기반 배터리 관리 시스템 상용화,Economic
서울 전농제 구역      억 규모 공공재개발 속도,Economic
 서학개미 브리핑  엔비디아  브로드컴의    칩 개발 따른 점유율 우려 ,Economic
서울만      쑥   내년 전국 아파트 입주물량 전반적 감소,Economic
 불이야  빌라 화재 막은   대한통운 택배기사,Economic
 뻥튀기 상장  파두  검찰 송치 소식에 장 초반   대 약세 핫종목 ,Economic
 조세심판례   영업활동 으로 인정받지 못한 신탁자산,Economic
코스피 장 초반      대서 강보합 외국인 기관  사자  종합 ,Economic
     중국  두산공작기계 관심 보였지만 국내에 매각 ,Economic
     물가 안도 환율     원으로 하락 출발,Economic
 어떻게 밥만 먹고 살아  삼성    자리까지 넘보더니  원종환의   줌인 ,Economic
 층간소음 없는 아파트  현대건설  새 바닥구조 상용화,Economic
최상목  대내외 불확실성 커 시장심리 안정토록 충분히 대응 ,Economic
퇴직연금 깨는 가입자 늘자 중도 인출 요건 강화 노후 소득 보장 취지 살려,Economic
한화시스템  차기 호위함 울산급 배치   에 심장 만든다 국산화 결실,Economic
최상목  외환스와프 확대 등 조치      억  차 밸류업펀드 신속 집행 ,Economic
지방분산에     심장  위기  수도권밖      이전땐 비용    억      ,Economic
데이터센터 시장 급성장      년    조원 규모     ,Economic
취임  년 서유석 금투협회장  유동성 지원부터 갈길 먼 디딤펀드까지,Economic
한화시스템  차세대 호위함 통합기관제어체계 수주 소식에 급등,Economic
내년 아파트 입주     줄어 서울은 증가,Economic
 인체 유래 줄기세포 로 난치성  소뇌실조증  치료 효능 검증,Economic
집 사느라 바닥나는 퇴직연금 정부  중도인출 요건 강화 추진,Economic
트럼프 머스크 만난 정용진    그룹주 강세 속 신세계     상한가 ,Economic
현대건설  내년 상반기 층간소음 없는 아파트 국내 첫선,Economic
내년 아파트 전국 입주 물량     급감   정작  이곳 은     급증,Economic
셀트리온  자가면역질환 치료제  앱토즈마주  품목허가 획득,Economic
   매각  해명 나선      두산공작기계    기업과 협의 없었다 ,Economic
 장기적 관점서 투자 결정 등 차분한 대응 필요  경제 금융수장 긴급회의,Economic
편의점 설 선물 판매 돌입  푸른 뱀의 해  주류부터 금메달까지,Economic
넷플과 한배 탄      시총  조 아른아른   연속 상한가 직행,Economic
스트레이 키즈    팝 역사 새로 썼다  빌보드      데뷔  연속  위  사상 최초 ,Economic
  인플레이션 우려 감소에 달러 원     원  하락 출발,Economic
 친절한 경제  부자도  저성장  중  금융자산 클수록  물려받았어요 ,Economic
현대엔지니어링  전농제 구역 공공재개발 수주,Economic
 뻥튀기 상장 논란  파두  검찰 송치 소식에  급락 ,Economic
     충격 소화한 코스피  외인 기관 매수에  상승 출발 ,Economic
내년 산업부     예산    조원  역대 최대  반도체 등 신속 집행,Economic
광주시 공무원     명  상무지구 골목상권 쏟아져 나온다 왜 ,Economic
 단독  키움증권  내년  제 호 초대형     인가 신청   종합금융팀  신설,Economic
나이벡  염증 및 섬유화 억제 펩타이드 기술 특허등록  기술이전 논의 가속화 ,Economic
 인천 시드니  티웨이로 간다     평균 탑승률    ,Economic
보험 비교견적 내줬더니  벤츠 화재에도  전기차 인기 ,Economic
     넷플릭스와 콘텐츠 공급 계약 소식에  일째    ,Economic
삼성물산  안양 종합운동장 동측 재개발 시공사 선정,Economic
 미국에서 안태어났다  트럼프  머스크 실세 논란 일축,Economic
카카오뱅크  주담대 중도상환수수료 면제 정책   개월 연장 ,Economic
경제     밸류업 세제 지원 지배구조 개선  여야정 협의체서 논의 ,Economic
최상목   천억 규모   차 밸류업 펀드  신속 집행 ,Economic
현대엔지니어링     시행     억 전농 구역 재개발 수주,Economic
기아  콤팩트      시로스   서 세계 최초 공개,Economic
     두산공작기계  중국과 매각 협의 없었다  최윤범 측에 반박 시그널 ,Economic
내란 후   일째     시장 불안 시 유동성 공급 추가 실시 ,Economic
      넷플릭스 파트너십 에 이틀 연속 상한가 핫스탁 ,Economic
 수입차는      국산차는 기아  차봇모빌리티  소비자 선호 차량 분석,Economic
한전  연료비조정단가    당  원 유지   분기 전기요금 동결 유력,Economic
카카오뱅크  주담대 중도상환수수료 면제  개월 늘린다,Economic
뉴욕발 훈풍에 코스닥    가까이 상승 출발,Economic
나이벡  염증 및 섬유화 억제 펩타이드 기술 특허등록  기술이전 논의 가속화 ,Economic
두산밥캣 수소지게차 첫 민간 공급   국책과제 이어 새 활로,Economic
 엔화 걱정 끝    에어서울  일본여행 혜택  통 크게  쏜다,Economic
  대한통운 택배기사  배송 중 신속 대응으로 대형 화재 막아,Economic
청년공인회계사회   서울시 민간위탁 사업비 회계감사  촉구 트럭시위,Economic
코스피  미 인플레 우려 완화에     선 회복 환율 ,Economic
최상목  금융 외환시장  지나친 쏠림은 향후 큰 반작용 수반 ,Economic
차바이오텍      억 규모 유상증자 결정에      급락 ,Economic
원 달러 환율    물가 안도에 소폭 하락        원,Economic
 김호광 칼럼  스타트업 보안  선택이 아닌 필수,Economic
지아이이노베이션     억원 규모 유증 결정에 급락,Economic
최상목  단기적 변동성 확대 우려 외환스왑 확대 등 신속 조치 ,Economic
트럼프 만나고 귀국  한국은 저력 있다고 말했다 ,Economic
        급등 양자컴퓨터가 뭐길래 관련주  들썩 ,Economic
     넷플릭스와 콘텐츠 계약에  거래일 연속     핫종목 ,Economic
   기업  고도화된 유료 서비스로 수익 개선   오픈    거대언어모델 무제한  뤼튼  캐릭터와 대화 별별 구독경제 ,Economic
 속보 한전  내년  분기 전기요금  동결 ,Economic
한전  연료비조정요금 유지  내란사태  후폭풍에 전기요금 동결 유력,Economic
코스피  뉴욕 환율 안도에 상승 출발         개장,Economic
빗썸   서울타워에 높이   미터 초대형  빗썸 트리  밝힌다,Economic
코스피       충격 소화     선 상승 출발,Economic
 르포  서울 끝  상봉동에   년 만 신축 한파에도 인파 몰렸다 부동산    ,Economic
올해 글로벌 채권펀드     억달러 넘게 유입  역대 최대 ,Economic
도심항공모빌리티용 리튬황전지 성능 개선 기술 개발,Economic
안양 종합운동장 동측에  래미안 하이스티지  들어선다,Economic
올해  만가구 착공 완료한    물량       월에 몰려,Economic
마이크로바이옴 신약 개화 아직인데   셀트리온  지속 투자 이유는,Economic
내년 전국 아파트 입주물량           년 이래 가장 적어 ,Economic
대신   코스피  레벨다운 요인 약화 기술적 반등 국면 진입 ,Economic
내년  분기 전기요금  동결  인하요인 미반영,Economic
최상목  금융 외환시장 지나친 쏠림은 큰 부작용 수반 가능성 ,Economic
 사고력은 로봇이 못 따라온다고   추론 능력마저 인간 넘은   의 정체는,Economic
현대건설  국내 최초 층간소음  제로  아파트 선보인다,Economic
  물가상승 우려 약화에 환율     원대로 하락,Economic
     두산공작기계 중국과 매각 협의 없었다  최윤범 측 반박,Economic
쿠팡  가성비 호텔 최저가 챌린지   인기 숙소 최대     할인 ,Economic
 단독 매입임대 실적 달성 어려울듯   탄핵에 공급정책도  맥  빠져,Economic
경제 금융 수장들  시장 불안하면 유동성 즉각 추가공급 ,Economic
  대선 이후 뉴욕증시 주도하는  트럼프 마피아 삼총사 ,Economic
     년   대 성장률 대한민국  개혁해야 회생한다 ,Economic
갑통알     세대가 돈 없을 때 쓰는 웃픈 신조어  경제용어사전 ,Economic
전통 제조업 도태되면 한국에 미래 없다,Economic
한화시스템  차기 호위함 울산급 배치     심장  만든다,Economic
이그니오   로  년 만에  배 번 투자자가 있었다  황정원의            ,Economic
새해에는 내 집 마련해 볼까  이수역 헤리드  관심,Economic
  분기 실적 개선 기대감에도    엠엔엠 지분율  반영     목표가 하향    ,Economic
  이슈 키워드  기업결합,Economic
상상인   씨에스윈드  내년 덴마크 법인 실적 불확실성  목표가 하향 ,Economic
이런 전망을 가진 사무실이라면  일이 술술 풀릴지도    의 방 ,Economic
고환율로 인한 원가 부담에   철강   가격 인상  나선다      플러스 ,Economic
수출 감소와 내수 침체 우려  재계 전망이 암울하다,Economic
  엔솔  퀄컴과 첨단 배터리 관리 시스템 상용화 나서,Economic
  년 개월 남았다  개정 시한 다가오는데 기후특위  탄핵 정국 뚫을까,Economic
인카금융서비스  모럴해저드 논란   유사수신 본부장 검찰 송치,Economic
 삼양식품  해외 모멘텀 확대 구간 초입 높은 성장성 주목 ,Economic
신한   삼양식품  공장 증설로 외형 성장 지속 목표가   만 원으로 상향 ,Economic
       생성형   액티브      년 수익률       ,Economic
 분기 전기요금 동결 연료비조정단가   당   원  유지,Economic
아시아나항공  제주노선  마일리지 항공편  또 푼다,Economic
 마켓인 이베이   마켓 소수지분     매각 추진,Economic
하나     리테일  인적분할 후 거래 재개  편의점 실적 관건 ,Economic
스포티파이 경영진  올해 주가 급등에    조원어치 현금화,Economic
  엔솔   퀄컴과 맞손 첨단     솔루션 상용화 나선다,Economic
현대제철   분기 아쉬운 실적 전망에    목표가  신한,Economic
 외국인 순매도  삼성전자에 집중돼  내년 시장 비관적으로 보지 말아야 ,Economic
셀트리온  악템라 바이오시밀러  국내 품목허가 획득 ,Economic
빗썸   서울타워에 높이   미터 초대형  빗썸 트리  밝힌다,Economic
편의점 설 선물 판매 돌입  푸른 뱀의 해  금메달부터 주류까지,Economic
 씨에스윈드  주가 낙폭 과해        유지 가능성   대신,Economic
  바이오사이언스  사노피와 차세대 폐렴구균 백신 공동개발,Economic
 이자만 최대    인데  급전 찾는 서민에 카드론 또 최대치,Economic
하나증권       넷플릭스와 역대급 계약 목표가  ,Economic
삼성물산      억 규모 안양 운동장 동측 재개발 수주,Economic
  투자   금  내년에도 강세 ,Economic
셀트리온  악템라 시밀러  앱토즈마주  국내 허가  목표 조기 달성,Economic
 속보  내년  분기 전기요금  동결 ,Economic
 종합  내년  분기 전기요금 사실상 동결,Economic
미래에셋증권      만기 자금  연금으로 환승 가속 세제 혜택 효과 ,Economic
수젠텍  프로메디젠에   억 투자  미래 성장 동력 확보 기대 ,Economic
 여보  내년엔 아파트 입주 올해보다 더 준대  전국 아파트 집들이     감소 부동산    ,Economic
금호건설  점진적인 주가 상승 기대  실적 정상화 시작  교보,Economic
        포커스       개월 수익률        국내 주식형  위,Economic
  운용        바이오     액티브      출시,Economic
상상인   파인엠텍      년 폴더블 생태계 확장 수혜주 ,Economic
 대한민국 어쩌나      년 수출마저      증가 그칠 전망,Economic
한국콜마  마스크팩 용기도 종이로   친환경 종이파우치 개발,Economic
하나        시총    조도 가능 목표 주가  배 상향 ,Economic
홍준표  대선 출마 시사,Economic
대신증권  스튜디오드래곤  내년 여러 대작 기대 목표가  ,Economic
현대건설  국내 최초 층간소음 없는 아파트 선보여,Economic
학부모들이 꼽은 교육계 최대 뉴스는       대입제도 개편 ,Economic
  엔솔  퀄컴 손잡고     만든다 업계 첫      기반  설루션,Economic
    대  일하기 싫어요    실적 전망도 어두운 건설업,Economic
 년 사이   분의    토막   한동훈 테마주  대상홀딩스우 주가에 무슨 일 ,Economic
내년   만    가구 입주  년 만에 최저 수준,Economic
신세계백화점 부산 센텀시티점   년째 연매출     클럽 ,Economic
산타랠리 패싱 눈물 나는 한국 증시  줍줍 기회 ,Economic
깜깜이  서울 지역주택조합   전수조사  불법행위    건 적발,Economic
아시아나항공  새해 제주 마일리지 항공편     석 공급,Economic
  리테일  분할 후 재상장 본사업 과소평가 해소 전망 하나,Economic
한산한 연말 속 수급 공방 환율     원대 고점 다지기 외환브리핑 ,Economic
원재료 가격 상승에 강달러 과자 음료수 내년엔 더 오른다,Economic
    발 후폭풍 가라앉을까 미국채 금리는 상승세 멈춰 채권브리핑 ,Economic
 매파  연준에 한 방 먹은   증시  저가  매력이  산타랠리  부를까  글로벌 마켓레이더 ,Economic
신한투자증권  삼양식품  해외 진출 모멘텀 초입 목표가  ,Economic
 굿모닝 증시  안도랠리에도 코스피는 환율 수급 부담,Economic
  인플레 우려 완화   국내 증시 훈풍 불까,Economic
    만가구 착공  달성한     만가구   월에 몰려,Economic
민주  국힘        앞선다   민주        국힘      ,Economic
스키타러 오려던 동남아 손님 발길 돌려  국내 관광지  찬바람 ,Economic
정준호 의원  등기부등본 왜곡 범죄 원천 차단  법안 발의,Economic
이마트  내년  고래잇 캠페인  혜택 쉽게 알린다,Economic
 어제장 오늘장  넷플릭스 오징어게임 시즌  공개 예정 관련주 상승,Economic
  엔솔  퀄컴과 손잡고 첨단     설루션 상용화 나선다,Economic
셀트리온  자가면역질환 치료제  앱토즈마주  품목허가 획득,Economic
한국 증시에 등 돌린 투자자들 올 코스피 회전율  역대 최저   투자    ,Economic
박셀바이오  바이오디자인랩과        치료제 공동 개발 업무계약,Economic
 스키장의 종말  온다는데 모나용평은 어떻게 지속 성장하나  안재광의 대기만성   ,Economic
위기설 돌파한 롯데  재무개선 속도  선택과 집중의 시간 ,Economic
 오사카 상하이 직행은 못 참지  저가항공       억  황금노선  재배분에 관심 고조,Economic
  바사 사노피  차세대 폐렴구균 백신 공동개발    조원 시장 공략,Economic
 이건 예상 없던 일  내년도 경제정책  전면 재검토  하나,Economic
 조선주   선박법에 수주 늘고 인센티브 전망  한국,Economic
 한국선   억 아파트 사기 쉽던데  불법은 다 동원했다는 부부의 정체는,Economic
 기업이슈   의회  조선업 항만시설법 초당적 발의 조선주 강세,Economic
 넷플릭스와의 역대급 계약     목표주가  배  ,Economic
우리은행  달러 원 환율  수급 싸움 속     원 초중반 하락 시도 ,Economic
빗썸  남산타워에 초대형  빗썸 트리  밝힌다,Economic
 부동산 코인 투자 어렵겠네  퇴직연금 중도인출 까다로워진다,Economic
 아침에       트럼프 만난 정용진,Economic
코스피  산타는 없지만  다 팔고 도망가기보단 더 사길 ,Economic
     에코프로머티  부진한 업황 내년  분기 회복 전망 ,Economic
    만원 월세 상가 아들에게 물려줬더니       대 노인의 후회,Economic
삼성전자    상무부와   억    만 달러 반도체 보조금 계약 ,Economic
연료비 조정단가   분기째 유지 탄핵 정국에  분기 전기료  동결  무게,Economic
트럼프  우크라 전쟁 빨리 끝내야    푸틴과 회동 시사,Economic
이노션     실적 약세에도 하방 경직성 매력적 현대차,Economic
 굿모닝 마켓    산타랠리  기대감에 뉴욕증시  대 지수 동반 상승,Economic
 클릭  종목  트럼프   대통령 취임 투자 기회 포착 ,Economic
트럼프 만난 정용진  정부 요청하면 트럼프 취임식 가겠다 ,Economic
내년   만세대 입주   년 만에 가장 적어 부동산 시장  냉랭 ,Economic
김포시의회  내년도 예산안 처리 진통  준예산  사태 우려,Social
경남 김해 육군   군수지원단서 폭발 사고  명 이송,Social
교육부  의대 정원 논의할 협의체 구성 검토     는 못 바꿔 ,Social
오세훈  탄핵 놓고  심리적 분단  상태 개헌 논의 시작해야 ,Social
아내 내연남 찾아가 흉기로 위협 강도짓   대 징역  년,Social
임영웅  뭐요  풍자한 코미디 유튜버   고소 협박 당해  호소,Social
홍준표 대권 설레발에  박정훈  나라 걱정은 않고  노욕뿐 ,Social
     학년도 대입 정시 가이드  의대 증원  수생 증가 다군 신설  물수능  정시 최대 변수,Social
    필로폰 운반하다 붙잡힌 외국인  명,Social
 수요 부풀린    차 전기본   윤석열 함께 탄핵돼야 ,Social
홍준표도     신고당했다  윤 대통령 비난 못 참아 ,Social
 아이들 건강한 세상     이준호  삼성병원에  억 쾌척,Social
 로또  등   장이 한 곳에서 동일인이면   억  잭팟     뉴스피드 ,Social
유시민  한동훈에     만원 배상 항소 안 한다,Social
 아이유 때문에 슬펐다  국민의힘   비대위원,Social
김진하 양양군수  주민소환 서명부 열람 논란  매우 부적절 ,Social
유시민   허위사실 유포 피해  한동훈에     만원 배상 확정 상고 포기,Social
서대문구  구 예산안 민주당 기습적 수정 가결 재의요구할 것 ,Social
 라임사태 주범  도피 도운 주가조작 일당 구속기소,Social
떡볶이 아래 남성 중요부위 사진이   보복 두려워  신고도 못한 가게 사장,Social
자해 말리는 어머니 흉기로 찌른   대 아들 체포,Social
 새해 첫 해  독도서 가장 먼저 뜬다  오전  시  분 첫 일출,Social
인권위   격리 강박 환자 사망  양재웅 병원장 등 관계자 수사 의뢰,Social
 올해 퇴직 공무원     명  년간 소득공백 정년연장 시급 ,Social
 시의원들에 돈봉투 전달  강수현 양주시장 기소,Social
광주 시민단체  막말 성희롱 유흥주점 출입 의원들 제명해야 ,Social
