titles,category
올해 글로벌 채권투자에 역대급 뭉칫돈 몰려 수익률은 글쎄,World
 글로벌 비즈  폭스바겐  독일 직원     감원,World
안성재      메인 장식  한국행  다들 미쳤다고 했다 ,World
삼성   보조금   억달러 확정      감액   글로벌 뉴스픽 ,World
   파나마   운하 반환  트럼프에 발끈    도 안 돼  종합 ,World
더 커진 머스크  입김     대통령직 양도  소문,World
 정부  셧다운  모면  부채한도  뺀 예산안 가결,World
트럼프  푸틴과 조기 회담 시사    우크라 전쟁 종식 서두를 것 ,World
트럼프   머스크 대통령 에 발끈  그는 대통령 될 수 없어 ,World
트럼프  나토        국방비 지출 압박 예고     방위비 늘리자 ,World
트럼프  우크라전 빨리 끝내야 수수료 안 내리면 파나마 운하 반환 ,World
트럼프  우크라  빨리 끝내야  임기 초기 푸틴과의 만남 시사,World
대만 헌재법  의회 난투극    응원봉 든 시민들  다만세  열창,World
 방위비          트럼프  나토 압박,World
   증시  올해 산타랠리 없다  비관론 확산,World
 운하 반환  트럼프 언급에    파나마  부글  외교쟁점 되나,World
 오픈    새 모델 개발 지연 학습에 필요한 데이터 등 한계 ,World
 글로벌 비즈 브리핑  독일 국민차 폭스바겐의 침몰 직원     감원 공장폐쇄는 철회  ,World
    세대 스텔스기      파키스탄에 첫 수출,World
미국 정부 셧다운 모면   트럼프    공화 강경파  추가 충돌 예고 ,World
무너진   년 동맹 퀄컴     과  칩 라이선스  소송 승소,World
폭스바겐의 침몰 직원   명 중  명 넘게 줄인다,World
푸틴  슬로바키아 총리와 회담 가스 공급 논의,World
미군  홍해서 아군 전투기 오인격추  조종사들 무사 ,World
멕시코   겨냥  수입의류 관세   트럼프에  같은 편  부각,World
   외교수장  방위비 늘려야  트럼프는        압박설,World
 가자 휴전협상     완료   국경  주둔  막판 걸림돌로,World
설리번  중동 정세 재편 트럼프  이란 핵 협상 진정한 기회 ,World
푸틴  크렘린궁서  친러    지도자  슬로바키아 총리 만나 종합 ,World
값싼 요리는  문맹   비싼 요리는  석사    음식점  시끌 ,World
뉴욕타임스  서울 유일의 미쉐린  스타 셰프 안성재 집중 조명,World
   외교수장  방위비 늘려야  트럼프는        압박설,World
외교 차관  트럼프측에 한국상황 설명 회복력 잘 이해  종합 ,World
트럼프 취임 전부터 폭주    의회가 막아냈다,World
푸틴  러 이익 내에서  와 관계 정상화 준비 돼  종합 ,World
러시아  우크라이나  오룔 연료 저장시설 또 드론 공격 ,World
글로벌 금리 인하에 올해 채권 펀드에     억달러 유입  사상 최대 ,World
미군  홍해서 아군 전투기 오인격추  조종사들 무사  종합 ,World
퇴임 앞둔 미국 상무부 장관  중국 반도체 수출 통제는 헛고생  투자가 중요 ,World
계엄군 총 잡은 안귀령      올해의 인상적 장면   선,World
푸틴   차세계대전 위험 커지고 있어 ,World
   원전  기회의 땅  동남아 원전 건설 확산 말레이도     년 이후 도입 추진,World
우크라  러시아 남부 오리올 연료창고 연속 드론 공격,World
푸틴  우크라  카잔에 드론 공격 더 큰 파괴 직면  종합 ,World
 축제 현장이    명 사상 아비규환으로  사우디   대   차 몰고  성탄마켓 인파 덮쳐,World
 울지마 키이우  진화 거듭해 전장 지배 우크라이나 드론의 비밀은 절박함,World
계엄군 총구 잡은 안귀령      올해의 사진 으로 뽑혔다,World
 한국 휘말려 끔찍한 결과  보조금 조사에 중국 반발,World
계엄군 총부리 잡은 안귀령      선정  올해 가장 인상적인 장면 ,World
    홈피 첫 화면 장식한 안성재  다들 한국행 미쳤다고 했다 ,World
 정상 국가  목표 시리아 반군  정권 이양 본격화,World
 포용 마저  혐오  극우 바람  독일 뒤덮나,World
대만 시위에도 등장한   응원봉  여야는 난투극,World
정용진  트럼프와 식사 대화  통상 압박 대비  각자도생 ,World
트럼프 측근과   한반도 전문가들이 본 비상계엄,World
정용진  트럼프  특별한 언급 없었다   한국 패싱  우려 고조,World
트럼프 연준 갈등 수면 위로   부의장  해임 대비 자문 받아 ,World
  년 전  영화 소품  탱크까지 동원했다  전쟁  년차  러시아 결국 이렇게,World
우크라  드론으로 최전선서       떨어진 러 카잔 공격,World
 마치 잔다르크 같다  계엄군 총 잡은 안귀령      선정  올해의 인상적 이미지 ,World
 세계를 보다 생존 교육 방공호 정비 전쟁 대비하는 유럽,World
트럼프      탈퇴 검토 지구촌 질병대응 능력 타격 우려,World
계엄군 총 잡은 안귀령 트럼프 피격 나란히      올해 장면  선정,World
정용진 회장      에 관심 저력 믿고 기다려달라 강조 ,World
풋볼선수  사돈  아들 전여친  트럼프 외교팀  광대 자동차  같아 ,World
 국방부   의  군사력 보고서  기만적  전쟁 중독  미국이 세계 위협 ,World
피격 트럼프 계엄군 총잡은 안귀령      인상적 이미지    컷,World
예상보다 강한  경제 최대 리스크는  이 사람 ,World
전세계 흔드는  슈퍼    트럼프  협상과 협박 줄타기  글로벌 리포트 ,World
 의회   트럼프 요구  뺀 예산안 처리  셧다운 모면,World
트럼프  취임 첫날     탈퇴 검토 지구촌 질병대응 위기 맞나,World
파키스탄    스텔스전투기        대 도입  인도에 공군력 우세 ,World
긴축하려니  저성장 늪   확장하려니  부채 폭탄  재정 딜레마 빠진 유럽,World
셧다운 위기 넘긴   트럼프 요구한  부채한도 폐지 는 불발,World
팔레스타인 고위 관리  가자 휴전 협상     완료     산발적 충돌은 계속,World
위기의 폭스바겐 공장폐쇄 대신     감원 극적합의,World
외신도 주목한 햄버거집 내란 모의  네란버거  소개도,World
   위 부동산 개발업체 또 부도 위기 내수 촉진 약발 안받아,World
 유럽 협상 주도권 노린 트럼프  나토 방위비        로 올려야 ,World
멕시코    무역장벽 높여    미국산 관세인하  트럼프 환심 사기 ,World
      대북 외교서 트럼프에 패싱당할 우려 양국 긴밀 협력해야 ,World
 관세 공포 전세계 통상전략 대수술,World
 상무     반도체 수출 통제  헛고생 투자 혁신이 유일한 길 ,World
 상무   반도체 저지는 헛고생 미국이 앞서나가야 ,World
 러 심장부에 전쟁  우크라 드론  최전선서       떨어진  러 후방  공격,World
트럼프  파나마 운하  미국에 바가지 통행료 반환 요구할 수도 ,World
후티 반군 미사일에 뚫린 이스라엘 방공망   명 다쳐,World
이번 주 세계 미리 보기 가자전쟁 휴전  우크라이나전 북한군 추가 파병 여부 등  월드콕  ,World
푸틴  러 이익 해치지 않는다면 미국과 관계 정상화 가능 ,World
중국  중국산 전기차에 상계관세 부과하면 한국도 피해 ,World
산타 할아버지는 어디쯤 왔나요   추적 사이트  카운트다운,World
 가자 휴전 협상     완료  이스라엘  난민촌 후티 공습은 계속,World
 영상  고층건물에 자폭드론 쾅 러 심장부 카잔에 우크라 대규모 공습,World
  상무장관 솔직 토로    반도체 저지 헛고생   앞서가는 수밖에 ,World
 나토  방위비    내라  취임 앞두고 동맹 압박 나선 트럼프,World
   크리스마스시장  테러 참사 범인은 사우디계  반이슬람  의사,World
아군 전투기 오인 격추한 홍해 파견 미군  조종사들은 무사 ,World
그리스   왕실    년 만에 공화정 인정 후 국적 회복 신청,World
롯데리아 내란 모의 세계가 알게 됐다,World
홍해 파견 미군  아군 전투기 오인격추  조종사들은 무사 ,World
 무자녀 노총각     만명 고독사 우려 확산하는 이나라,World
미 상무부장관  퇴임 앞두고  중 반도체 저지는 헛고생 미국이 앞서나가야 ,World
시리아 반군  내각 꾸리고 외교 나서 미  반군 수장 현상금 해제,World
환생  반전  재벌남 넘치는 중국  마이크로 드라마   당국  예술성 높여라  규제,World
 트럼프 온다  각국 중앙은행 금리 동결 도미노,World
트럼프 취임  달 남았는데      도  리더십 휘청 ,World
트럼프   아베 부인과 만남서  세계평화 위해   대만 큰 문제 ,World
   갈취 멈춰라  트럼프  나토 파나마에  경고장  날렸다,World
 가자 휴전 협상  부 능선 올라  연내 타결설도,World
내각 구성 외교 행보 나선 시리아 반군    테러단체  꼬리표 떼나,World
올해의 올림픽   대 뉴스에 남북 탁구 선수들  시상대 셀피 ,World
트럼프  나토에        국방비로 요구할 듯   우크라 지원은 계속 ,World
 명품백  비트코인으로 샀어  암호화폐 결제 받는 백화점,World
 셧다운  간신히 면한 미국 미 언론  트럼프  의회 장악 험로 ,World
 이스라엘 우크라는 새발의 피    여기서 전쟁나면 전세계         급감,World
 경제 비관하면 해고     중국  이코노미스트들  입단속  강화,World
   파키스탄에      스텔스기 판매    세대 첫 수출,World
 관영지     악의적 서방 방식 택해   전기차 보조금 조사  움직임 ,World
    선정 올해 가장 인상적 사진에 계엄군 총 잡은 안귀령,World
 트럼프 시대  앞두고 영국  나홀로 친중  노선에 동맹국들 싸늘,World
 비싼 커피 판 돈으로   분노한 스타벅스 바리스타들 결국,World
   명 태우고 감쪽같이 사라진 여객기   년만에 수색 재개한다,World
중국 핵무기 두고 미 중 공방  핵탄두  년새    개 급증   핵 선제타격 원칙 돌아보라 ,World
 트럼프 외교팀  광대자동차 같아    상대국에 모욕  비판도,World
취임하기도 전에  패    트럼프표 예산안  좌초,World
동남아 원전 건설 바람 확산 말레이도      년 이후 도입 추진 ,World
 왕이 되길 포기합니다      년만에 국적 회복 신청 평민된 이 나라  왕족 ,World
  닛산 혼다 통합   사업이 시너지 발목  지적,World
 곧 트럼프 시대인데    나홀로  친중  노선에 동맹국들  절레절레 ,World
 월클뉴스  죽은 아베가 구원투수  일본 총리  트럼프 만난다는데,World
경사각 무려      도  세계서 가장 가파른 케이블카 나왔다,World
   파키스탄에     스텔스 전투기 판매  세계 시장 진출 발판 마련 ,World
사흘간  마가 대잔치  열리는 트럼프 취임식 역대 최다액 모금,World
 너무 아찔해요  스위스 알프스에  세계 가장 가파른 케이블카 ,World
우크라이나  최전선에서  천  떨어진 카잔에 드론 공격,World
 발트해 케이블 절단 의혹  중국 선박 한달 만에 출항 조사 결과는 미공개,World
중국  파키스탄에 스텔스전투기        대 판매   세대 첫 수출 ,World
그리스  왕실  군주제 폐지   년 만에 공화정 인정,World
러 파병 북한군 위조 신분증 첫 공개    년생 리대혁 ,World
   셧다운  막았지만  트럼프  공화당 장악 한계 노출 ,World
시리아 내전 끝났지만 멀게만 느껴지는 중동 평화  최준영의 글로벌 워치 ,World
트럼프 시대 코앞인데    나홀로 친중  노선에 동맹국들 싸늘,World
스위스 알프스에  세계 가장 가파른 케이블카  경사각 약   도,World
트럼프  아베 부인과 최근 만남서    대만 문제 풀어야 ,World
트럼프  파나마운하   에  바가지  통행료 중단 안하면 반환 요구 ,World
 가자지구 휴전협상     완료    이스라엘군  국경 완충지대 주둔할듯,World
팔레스타인 고위 관계자  가자 휴전 협상    까지 완료 ,World
 가자 휴전협상     완료    연내 타결설도,World
폭스바겐 노사  극적 협의      년까지    만명 감원 공장폐쇄 철회,World
장갑차 떨어지니 영화소품 가져다 쓰는 러시아 구소련 탱크도 동원,World
출산 중 자궁파열  결국 안락사 지옥에서  원숭이떼 탈출 ,World
중국  호주산 랍스터 수입 규제 해제  년여 무역갈등 끝,World
중국 관영지  한국  서방에 휘둘려 중국 전기차 보조금 조사 움직임 ,World
   파키스탄에 스텔스전투기        대 판매   세대 첫 수출 ,World
  년 전  의문의 실종       기  수색 재개한다,World
 한국    전기차 반보조금 조사 움직임 어둠 드리울 것 ,World
트럼프의 엄포  파나마운하 미국에 바가지  반환 요구할 수도 ,World
전 미식축구 선수에서 장남 여자친구까지  트럼프 외교팀  상대국에 모욕 ,World
 너 그 구찌백 무슨 돈으로 샀어    나  비트코인으로 샀는데 ,World
트럼프  파나마운하   에 바가지 통행료 반환요구할수도 ,World
 안귀령의 강철 같은 빛     가 꼽은  올해의 이 순간 ,World
 풋볼선수  장남 여친  부적합 트럼프 외교팀  상대국에 모욕 ,World
바이든   트럼프 요구  부채한도 폐지 뺀 예산안 서명 셧다운 모면,World
  년 전 흔적도 없이 사라진    명  실종된 말레이 여객기  다시 찾는다,World
애플  시총  조달러 눈앞에 전세계 기업 중 최초,World
아사드 무너진 시리아 맡겨도 되나 반군  오디션  돌입한 서방,World
 가자 휴전협상     완료    연내 타결설도,World
 관영지     서방에 휘둘려  전기차 보조금 조사 움직임 ,World
트럼프와 식사한 정용진  나한테 여러가지 물어봐 내용은 공개 못 해 ,World
 연준 부의장  해임 우려에 법률 자문  트럼프 연준 갈등 신호,World
 가자 휴전협상  부 능선 남부 이스라엘군 주둔 놓고 씨름 ,World
 오징어게임 질렸다 외딴섬 가고 싶어  황동혁 감독  무슨 일,World
트럼프  아베부인과 최근 만남서  세계평화에   대만 큰 문제 ,World
러  파병 북한군  위조 신분증         년생  리대혁  한글 이름 선명,World
   비상계엄에 한일 관계 악영향 우려  반일 이미지  이재명 향한 걱정도,World
   셧다운  아슬아슬  모면 가디언  트럼프  공화당 장악력 한계 드러내 ,World
공개      오징어 게임   벌써부터 해외 평단 호평 이어져,World
 무너진 시리아 경제 재건 첫 단추는 서방 제재 해제 ,World
너도나도  닮았다  남미 트럼프    한국 트럼프 비교해보니  한중일 톺아보기 ,World
트럼프   어프렌티스  전   를  영국 특사 로    대사는 억만장자 은행가 이미 임명,World
바이든  부채한도 뺀 임시 예산안 서명   셧다운  위기 종결,World
 셧다운 도박  실패   가디언  트럼프  공화당 장악력 한계 드러내 ,World
 영화 소품을 전쟁터에   장갑차 다 잃은 러시아  급히 동원한 탱크 정체,World
 셧다운 위기    분 넘겨  아슬아슬 모면 트럼프 요구  불발   이상은의 워싱턴나우 ,World
트럼프  본인 출연 리얼리티   쇼 제작자 영국 특사로 지명,World
시총  조 달러 임박  내년 슈퍼사이클 시작된다 ,World
팔레스타인 고위 관계자  가자 휴전 협상     완료 ,World
대만  퇴임 앞둔 바이든에      억 군사 원조  받아내,World
 의회  트럼프 요구  부채한도  뺀 예산 처리 셧다운 모면,World
슬금슬금 오른 애플 주가  어느덧 시총  조 달러  눈앞 ,World
축의금 조의금 기준은 돼지고기 한 근 값,World
 한국 인재 모셔라  임금 올리고 주거비 지원,World
    년 이후  부패 고위급 최소   명 사형,World
블랙홀 근처에 어떻게 쌍성계   연구진     만년 내 합쳐질 것 ,World
친환경론자의 변심  석유 필요  외친 머스크  트럼프와 결 맞췄다 머스크 트럼프 ,World
콩고의 부시라 강에서 여객선 침몰    명 죽고    여 명 실종,World
세습독재 시리아와 북한의   년 밀월관계,World
정용진  트럼프 면담 에  어떤 내용 오갔나  관심 집중,World
정용진   한국패싱  트럼프 만나 식사했다  여러 가지 물어보더라 ,World
중국이  일국양제 모범생  마카오 띄우는 이유는  차이나우 ,World
애플    아이폰에    탑재 추진  텐센트 바이트댄스와 협상 중,World
 수출 신기록  자화자찬  값싼 중국산 반도체가 몰려온다  차이나는 중국 ,World
내륙 드론 공습 격화   이번엔 카잔 하르키우,World
 암 백신 내년부터 무료 배포  러시아 파격 선언에 과학자들은  엥  과연 ,World
정치 불안 커지는 프랑스 독일 유럽 경제 먹구름,World
    점점 더 분열되는 세계의 가장 확실한 수혜자 ,World
총알 구멍에 이름은    년생 리대혁   북한군 위조신분증 공개,World
트럼프 만난 정용진  신중 모드 에도 향후 역할 기대감 커질 듯,World
정용진  트럼프와      분 대화 내용은 공개 못해 ,World
시리아 과도정부 조각 작업 각국 대사관 재가동,World
시리아 과도정부 조각 작업 각국 대사관 재가동 종합 보 ,World
 전략가  트럼프  나토에      대비    국방비 지출  요구,World
비트코인  나흘 만에 하락세  일단  멈춤  만 천달러대 거래,World
미 하원  막판 임시 예산안 합의에 셧다운 모면,World
정용진  트럼프와 심도 깊은 대화   정부 기업 통틀어 첫 소통,World
정용진  트럼프와      분 심도있는 대화  정재계 중 처음,World
정용진 신세계 회장  트럼프와 대화     내용은 공개 못 해 ,World
바이든  부채한도 제외 임시 예산안에 서명 종합 ,World
 드론  로켓부터 항공모함까지   치열한 드론 확보 전쟁,World
 의회   트럼프 요구  부채한도 뺀 예산 처리 셧다운 모면 종합 보 ,World
트럼프까지  서머타임 폐지       여 년 관행 사라질까 ,World
북한군 투입 인정 않는 푸틴 러시아는 왜 북한군을  부랴트인 이라 할까  디브리핑 ,World
 최전선서  천   러 카잔에 우크라 드론 공격 항공 일시 마비 종합 ,World
 유사시 미사일 제대로 쏘겠나      보고서  중국군 부패 후벼팠다,World
 반군 지원  카타르  시리아에 대사관 재가동 종합 ,World
    명 넘게 사상   크리스마스 마켓 돌진한   대 의사에 서방국가  초비상 ,World
독일 크리스마스 마켓 차량 돌진에 세계 각국 긴장 테러 경계 태세,World
반대 시위에   응원봉  빛났다 국회서 여야 난투극 벌인  이 나라 ,World
미  삼성 반도체 보조금     감액   트럼프 변수 작용했나,World
 벌써   년째  산타 루돌프 썰매 경로  실시간 중계 나선 곳은,World
대만서 법 개정 놓고 여야 난투극 반대시위에   응원봉 도 등장 종합 ,World
우크라이나  러시아 최전선       떨어진  카잔 에 드론 공격,World
 추위에 떨고 있는 노령연금 수급자들   난방비 삭감  비꼰 노래 인기 끈 나라는,World
우크라  최전선서       떨어진 러 카잔 드론 공격,World
최전선에서        떨어진 러시아 카잔  우크라이나공군 드론 피습 항공 마비,World
바이든 행정부의  삼성 보조금  삭감 결정 지급은 다음 행정부가,World
 울지마 키이우  키이우 진격로 됐던 체르노빌  방사능 수치 불안정,World
 후방도 안심 못 한다  러 카잔에 날아든 우크라 드론,World
우크라  러시아 깊숙한 카잔까지 드론 공격,World
  정부  경제 전망 나쁘게 하면 알지   증권맨 압박 커져,World
 최전선서  천   러 카잔에 우크라 드론 공격 항공 마비,World
   시간 동안     명과 잠자리  세계신기록 도전하더니,World
 얼어붙은 성탄절   서 난방비 삭감 비판 패러디곡 인기,World
  중산층 여성들의 롤모델  머스크 모친도  비밀병기   세계는 지금 ,World
미 중 무역전쟁 임박  친중파 머스크  중재  키플레이어  될까  세계는 지금 ,World
독일서 차량 돌진    명 사상 용의자는 사우디 난민 출신 의사,World
  세대가 흔든 술집 풍경 기네스 대란에  구매제한 까지 등장한 이유,World
 영화소품 아냐   러 장갑차 동나더니 동원된 탱크에  화들짝 ,World
트럼프  나토에         방위비 올려라    에도  관세 압박 ,World
 아디다스 푸마와 경쟁  러 진출 예고한  업체는,World
 탱크 동난 러시아  영화 소품까지 동원 ,World
러시아  영화 소품 쓰던 구소련 탱크까지 전쟁에 동원,World
  교육부  바이든 퇴임 앞두고  학자금 탕감안  철회     만명 영향권,World
장갑차 동난 러시아  영화 소품 쓰이던 구소련 탱크까지 동원,World
미 교육부  바이든 퇴임 앞두고 학자금대출 탕감안 공식 철회,World
  동창리 발사장  위성 조립 건물  외부 공사 완료 ,World
 너무 싸게 팔아 망했다  아디다스에 밀린 나이키  가격 올리나,World
 금고까지 털어 도망갔다  푸틴 절친 기업의 만행,World
말레이  실종 여객기 재수색 결정 세계 최대 항공 미스터리 풀릴까,World
 트럼프 측  나토 동맹국에      대비 국방비    인상 압박  구상 전달 ,World
브라운 합참의장 경질 유보  풋볼경기 특별 박스석 독대 결정적,World
 벤츠 삼각별  만든 협력사도 파산 신청   엄습하는 카마겟돈 공포,World
 당국자  파키스탄    등 도달 가능한 미사일 기술 개발 ,World
제임스 웹이 포착한  초기 블랙홀의 식곤증    과식하고 낮잠 중 ,World
미 의회  시한   분 넘기고 예산안 처리 셧다운 피했다,World
      트럼프  합참의장 경질 방침 유보  풋볼경기때 함께 응원 효과 ,World
미국 의회   트럼프 요구  부채 한도 뺀 예산안 처리 셧다운 모면,World
 임기 막판  바이든 정부  우크라에  조 천억원 무기지원,World
풋볼경기 박스석 독대 약발   트럼프  합참의장 경질방침 유보 ,World
 올해는 어디로 오실까  성탄절 이브부터 산타 비행 경로 생중계,World
타이완 여야 난투극 공직자 소환법 처리 두고 갈등 폭발,World
 의회  셧다운 시한   분 넘겨 예산안 가결 바이든 서명만 남아,World
 상원도 부채한도 뺀 임시예산안 가결 셧다운 피해,World
 의회 부채한도 뺀 예산안 처리  셧다운 모면 종합 ,World
바이든 우크라에    조 마지막 지원  트럼프는 지원     ,World
트럼프  유럽 방위비 목표 또 높여  미국산 석유도 사야 ,World
 그림자 대통령 머스크  트럼프 확성기 역할하며 선동   거세지는 비판 디브리핑 ,World
바이든의  마지막 선물   우크라에  조  천억원 무기지원,World
 의회   트럼프 요구  부채한도 뺀 예산 처리 셧다운 모면 종합 ,World
미국 정부 임시예산안 상 하원 통과 셧다운 피했다 종합 보 ,World
미  삼성 반도체 보조금     감액   트럼프 변수 작용했나,World
  상원 임시예산안 가결 셧다운 모면,World
러 파병 북한군  위조 신분증  공개  총알 혈흔 자국에 이름은  리대혁  ,World
   파키스탄  미국 도달 미사일 기술 개발 로켓 크기 우려 ,World
폭스바겐      년까지  만    명 감축 합의  전체의     ,World
조 바이든  대만에     억원 군사원조  방위물품 훈련 등,World
  년전 실종 여객기 미스터리 풀릴까 말레이  재수색 결정,World
미국  삼성전자 반도체 보조금    조원 확정  원안 대비     ,World
퇴임 한 달 남은  바이든 대만에     억 원 군사원조,World
올 크리스마스에도 산타가 뜬다    일부터 전세계 경로 생중계,World
 북한 동창리 발사장  위성 조립 건물  외부 공사 완료 ,World
  년전 실종 여객기 미스터리 풀릴까 말레이  재수색 결정,World
러 파병 북한군 경험담 확산  드론 계속 날아온다 ,World
 최악의 항공 미스터리    년 전 실종된 말레이 여객기 수색 재개 어디에 ,World
혼다 닛산 합병의 실체   가미카제식  관치의 개입    글로벌 ,World
대만 의회서  헌재결정 의원소환  문턱 높인 법안 가결,World
미  삼성 반도체 보조금     감액   트럼프 눈치 보기 ,World
경복궁 찍고 간 산타  올해는 어디    일부터 야간비행 생중계,World
 당국자  파키스탄   미국 도달  탄도미사일 기술 개발중 ,World
임기 말 판사 임명에  올인 한 바이든   트럼프를 이겼다 ,World
 퀄컴    반도체 설계 암과 라이선스 소송서 승소,World
대만서 헌재결정 의원소환 어렵게 하는 법안 가결 여야 난투극,World
   시리아 반군 수장에 걸었던 현상금 해제 유화 손짓 화답,World
트럼프가 측근 그리넬을 특사로 임명한 속내      틈 벌려 중국 때리기 ,World
바이든    경계 속 대만에  천   억원 군사원조 승인,World
 산타 할아버지 어디까지 오셨나  전세계 생중계,World
