titles,category
    에 뛰어드는 국내 제약사들 기회와 리스크는,Culture
 불확실성의 시대      년 앞두고   친환경차 수출  시계제로 ,Culture
 혈관 수축 문제     추울 때마다 피부 가려운 이유는 ,Culture
세계 최다 췌담도암 수술 장진영 서울대병원 교수,Culture
 이자   야   감성 박스카  기아 시로스  벌써     만뷰  인도 잭팟  예고,Culture
티메프 여행상품  판매자 환급 조치 나왔지만 합의는 난망,Culture
시원하다  아침에  황금구렁이  보는  가지    ,Culture
 건강한 가족  먹고 말하고 숨쉬기까지 힘들어져 흡연자는 발병 위험  배,Culture
 건강한 가족   비만치료제  위고비  정상체중 효과 부작용 검증 안돼 득보단 실 클 수도,Culture
초겨울 불청객 코막힘  피부 건조 습도 관리 이렇게  건강한 가족 ,Culture
 건강한 가족  겨울철 급성 뇌졸중   혈관 내 수술 로 골든타임 잡는다,Culture
  박당   달러 더 내세요   호텔 수수료 갑질에 피해 속출,Culture
연인 목에  키스 마크  남겼다가 자칫 사망으로 이어질 수 있다  헬스톡 ,Culture
신춘문예로 흘러든  한강의 물결 ,Culture
중앙선 철도 완성  두만강 가는 꿈 동해선     기적,Culture
      뉴시스 선정   대 뉴스    한강  한국인 최초 노벨문학상 수상,Culture
 가정예배       월   일  예수 그리스도  만민의 구원자,Culture
 오늘의 설교  말씀을 품은 복된 삶,Culture
성탄특집 다큐멘터리  죽음에서 돌아오다 메일린의 기적    일 방영 박용만 회장이 전하는  바티칸의 기적 ,Culture
 날씨  최고 추위에  도심 폭포수에도 고드름    이번 주  한파  반복,Culture
 증오의 정치 넘어 야수의 정치  지금은 해방 직후보다 더 위험 ,Culture
예매했는데 자리가 없다고   오페라 투란도트  황당 운영 논란,Culture
 조용헌 살롱         권력과   ,Culture
 르포 대한민국    년 동안   점 추가 하락  한국 성인 문해력은      평균에 미달한다,Culture
 오늘 날씨   영하   도  맹추위 온다   스키장 다녀온 후 눈이 아프다면 ,Culture
투란도트 연출가  내 작품으로 인정못해  개막일 결별선언,Culture
부산에 출동한    여명의 석유 로비스트들 기후로운 경제생활 ,Culture
연천  철원 양구  한파경보    이번 주  한파  반복,Culture
    첫 화면 등장한 안성재  한국행  모두가 미쳤다고 했다 ,Culture
 키가 곧 스펙인데 천만원 쯤은  쑥쑥 크는 성장호르몬 시장  규모가 무려,Culture
 편도만   만원 냈다  케이윌 분노   여행 가려다 날벼락 무슨일,Culture
최고 추위에  도심 폭포수에도 고드름    이번 주  한파  반복,Culture
근육량 감소하는   세 이후에도  식스팩  만들려면 이렇게,Culture
 투란도트  개막부터 논란 연출가  내 작품 아냐  하차 선언,Culture
 식욕 줄고 활동량 늘어      이 효소  억제하니 살 빠지네,Culture
 뉴스  날씨  내일 아침도 추워요  동해안 건조특보,Culture
 꿀잠 돕고 소화까지 촉진      이것  한 알의 놀라운 변화  ,Culture
박수홍 아내 김다예   벌써  자 탈모     모발 한 움큼 빠져  무슨 일 ,Culture
고혈압약 먹을 땐 매실 바나나 조심하고  관절염 약 복용 땐  이것  피해야,Culture
 중요부위가 뼈처럼 굳었다  충격적인 희소병 원인  이것 일 수 있다고 ,Culture
    억 적자 낸     우티 지분 전량 매각,Culture
한국인만  바글바글 하더니 일본서  압도적  위  터졌다,Culture
정용진  트럼프측에  한국은 저력이 있다고 말해 ,Culture
   만 유튜버  수익 공개  광고 안 하면 적자 못 면해 ,Culture
 거세된 내시와 혼인하는 게 목표    조선 양반가 규수들  속셈이 따로 있었다는데,Culture
 날씨  내일 출근길도 영하   서울   도 대전   도,Culture
강추위 내일 아침 절정 전국 대부분 영하권,Culture
 싸고 좋은 여행은 없다  두 번의 저가 패키지여행이 준 교훈,Culture
티켓값    만원  투란도트  연출가  내 이름 빼라  개막 직전 결별 선언,Culture
하루만 쉬어도 표가 나는데 석 달을 쉬었으니   ,Culture
 유지어터  박세미  밤에  이 음식  먹으며 체중 관리  어떤 효과 있길래 ,Culture
 대체 애들 옷이 왜 이리 비싸   이 기업  가성비 앞세워  배씩 몸집 키웠다,Culture
 시니어그룹   입맛이 없다 는 표현의 진짜 속내는 이것입니다,Culture
자신의 이익 위해 군대 동원하는 독재자를 조롱하는 맥주  윤한샘의 맥주실록 ,Culture
기아  유럽서       만대 팔고 멕시코        수출,Culture
최고 추위에  도심 폭포수에도 고드름    이번 주  한파  반복,Culture
심부전 환자  인공심장 달면 뜻밖에 심장근육 재생 ,Culture
아침 공복에 달걀과 함께 먹었더니    이 음식 들  몸에 어떤 변화가 ,Culture
너도나도      참전 기술 고객확보가 관건,Culture
      프로젝트  완치 어려운 크론병  조기 치료로 합병증 막아야,Culture
 날씨  내일도 강추위  중부 한파특보 동해안 대기 건조,Culture
 전문의 칼럼  사랑니 발치 시 합병증과 오해,Culture
베를린국제영화제  틸다 스윈튼과    년 인연  마침표 찍나   명예황금곰상 수여  시네마랑 ,Culture
 전기차로 갈아탈까       만원대 전기차 몰려온다,Culture
 종합 코엑스  투란도트  연출가  개막 앞두고  내 작품 아냐  결별 선언 파문,Culture
포켓몬 짱구 손잡고  스파오키즈 일냈다,Culture
 날씨  강한 바람에 체감 온도  뚝  동해안 화재 유의,Culture
 배한철의 서울지리지  거세당한 내시  조선의  등 신랑감이었다,Culture
연출자  내 이름 쓰지마  공연 떠났다 오페라 투란도트  뭔일,Culture
 살 빠지고 피부 좋아져     이것  한 스푼  겨울에 더 좋다 ,Culture
월요일 아침 매서운  한파  수도권 출근길    도까지 내려간다,Culture
 너 구찌 가방 무슨 돈으로 샀어   비트코인으로 명품백 산다는데,Culture
 날씨  휴일 한낮에도 전국 강추위 계속 한랭질환 주의,Culture
 날씨  전국서 강한 바람 매서운 한파에 기온  뚝 ,Culture
눈가 떨릴 때 마그네슘 보충하면   이 효과 는 덤으로 본다,Culture
 날씨  휴일 종일 체감 영하권 동해안 수일째 건조특보,Culture
 날씨  경기 강원 곳곳  한파경보    따뜻한 실내 시민들 북적,Culture
이번 주 아침 영하   도 맹추위   바람도 쌩쌩,Culture
 커피에 설탕 타면  밤잠 더 설친다  왜 ,Culture
  대 여성      너무 외로워     갱년기에 특히 나쁜 생활 습관은 ,Culture
전국 기온 뚝  중부 한파특보 내일도 전국 강추위,Culture
속편 아니면 재개봉 달라지진 못하고 달리기만 한 올 영화계,Culture
탄핵 정국에 다시 보이는  콘텐츠 진면목,Culture
  억원 작품 바나나를  꿀꺽  돈 자랑에 먹힌 현대미술,Culture
매진    쏟아지는 취소표       내란사태 가 부른 공연 양극화,Culture
 내일 날씨  출근길 영하   도  강추위 이어져,Culture
   년째 아침마다 남편과  이것  한다   신애라  연예계 대표  잉꼬부부  비결 ,Culture
 날씨  중부지방 곳곳 한파특보 한낮에도 체감 영하권,Culture
            대만의  호국신산           ,Culture
 날씨  일부 경기 강원  한파경보    낮에도 종일 추워,Culture
 타보고서  폭설도 끄떡 없어 르노  그랑 콜레오스   가솔린도 강했다,Culture
   시 날씨  매서운 한파에 기온  뚝  낮에도 체감 영하권,Culture
 눈화장 때문에 실명    눈에  이것  들어가 안구 녹은   대   왜 ,Culture
영양사가  절대 냉장고에 안 넣는다 고 밝힌 네 가지 음식  뭘까 ,Culture
당분간 중부내륙 아침에 영하   도   강추위 대비하세요,Culture
백종원 제치더니 교촌 회장님도 반한  막걸리  정체,Culture
근시  단순 시력 저하 아닌  눈 건강 시한폭탄 ,Culture
미국에서 내란이 벌어졌다   한국인이라면 가슴 쓸어내릴 영화  시빌 워 ,Culture
 씨네멘터리      년  올해의 영화    ,Culture
 체중 줄이고 근육량 늘려     이 음식  적당히 먹으면 건강  몸매 관리에 도움,Culture
중부 곳곳 한파주의보 한낮에도 체감 영하권,Culture
오산 로또 매장서  등  장 연달아 나와 당첨금만   억원,Culture
크리스마스에  와인  직접 담가볼까   주방 속 과학 ,Culture
가수 오디션 출전 때    년내 연예대상 받겠다 더니    꿈 이뤘다,Culture
 일요와이드  중부 한파주의보 찬 바람에 체감    도 강추위,Culture
 날씨  밤사이 강한 한기 기온  뚝    이번 겨울 최저 기온,Culture
 날씨  휴일 강추위  중부 내륙 한파주의보 전국 강한 바람,Culture
 니가 우리 동생이라고   세 자매  무책임한 아빠 장례식에서 이복동생 보더니  씨네프레소 ,Culture
아침 기온    도  낮 최고  도 월요일도 춥다,Culture
 영하   도  강추위 닥친 한반도 당분간 동장군 기승,Culture
내년 신규 전공의  정원의    산부인과  명 흉부외과  명,Culture
운동 실컷 해놓고   이 간식  먹으면 살찌는 지름길,Culture
 당뇨  치매 위험 높아진다      이 습관   멀리해야 하는 이유는 ,Culture
유럽 전기차 시장 부진  테슬라 빼면 성장,Culture
 날씨  휴일 서울 체감         강추위 중부 내륙 한파주의보,Culture
기아  콤팩트      시로스  세계 최초 공개 내년 인도 판매,Culture
어르신들  겨울철 공포  골절 집안  이것 부터 바꾸세요  건강한 가족 ,Culture
탄수화물이지만 체중 감량엔 좋은 식품  ,Culture
 요구르트  무설탕 음료도     건강에 좋다는  이 음식   장 건강에는 독 ,Culture
 날씨  이번 겨울 들어 가장 추워   낮에도 체감 영하권,Culture
 한잔의 추억 과 맞바꾼 명철한 판단력   알코올이 내 몸에 남긴 흔적  동인보감 ,Culture
 빙글빙글 어질  이석증  물리치료만으로도 치료 효과 있어 ,Culture
 제주날씨  강풍 몰아쳐 기온 뚝   한라산에 눈     더 온다,Culture
정용진  트럼프 당선인과 식사해 심도있는 대화 ,Culture
  시 날씨  경기 강원 충북 한파주의보 찬바람에 기온  뚝 ,Culture
  이 음료  마시니 살겠다  차정원  자주 마시면 위험한 까닭은 ,Culture
 산 타러 한국 왔어요  외국인들    등산 에 푹 빠진 이유  이슈  ,Culture
 역시 석열이 형은 법보다 밥이야  모두가 행복했을 텐데,Culture
  년차 배우 박진희가 기후우울증에 걸린 사연              ,Culture
주춤해진   판매  내년엔  볼륨 모델  신차도 보릿고개,Culture
  가 인정한 완벽한 몸매 지닌 여성  주  일  이 운동  한 덕분 ,Culture
코아스템켐온  루게릭병  상 유효성 입증 실패에 주가 한주새         바이오 ,Culture
극단 선택 예고 후 떠난 절친     대 남성  영혼 치료 위해 베트남에서 한 일은  푸디  ,Culture
겨울만 되면 뼈  관절 약해져   이 음식  영양제보다 낫다 ,Culture
 날씨  휴일 강타하는 강추위 낮에도 최고     ,Culture
    회 로또  등  곳 배출한 당첨 명당 어디 ,Culture
붉은 소변 보고도  지나면 괜찮겠지    방치했다간 검은색으로 변합니다  생활 속 건강      ,Culture
   좋네  너 성공했구나  고향갈 때 타고 싶은  금의환향  제네시스      는  세상만  ,Culture
선미  살 안찌는 체질 아냐     이곳 만 살 붙어  관리는 어떻게 ,Culture
맛 좋은 방어   기생충  걱정 안 해도 될까  건강하게 먹는 법은 ,Culture
 엉터리 치료에 사망자 세계  위인데  코로나 영웅으로 불리는  이 남자         ,Culture
 권력 멋대로 휘두르면 몰락  리더의 역할이 왜 중요한지 보여준 사람들        ,Culture
불쾌감 주는  입냄새  원인과 예방법은 ,Culture
아침마다 눈 아프고 뻑뻑 안구건조증 아닌  이 질환  ,Culture
   는 기아     트럭 세단은 현대차  치열했던 집안싸움,Culture
 어제보다 더 추워요  아침 최저    도  한파  낮  도 안팎 오늘날씨 ,Culture
 날씨  이번 겨울 최고 추위   낮에도 찬 바람  쌩쌩 ,Culture
라면 국물에 밥은 못 참지 한 달에 한 번만 먹어야 할까요 ,Culture
전신 근육 강화에 최고라는  데드리프트   허리 아픈 사람이 해도 될까 ,Culture
 사실 초밥을 가장 좋아해요     만 고기 유튜버  육식맨 의 비밀  주말특급 ,Culture
   양승동의 공정방송 투쟁   년,Culture
 동지 에     대설 이어 한파   오늘 중부     ,Culture
 가정예배       월   일  그리스도의 십자가  우리의 십자가,Culture
머리에서 갑자기  이 느낌  들면  명 중  명 사망하는   초응급 상황 ,Culture
 날씨   동지 에     대설 이어 한파   내일 중부     ,Culture
 연말인데 한 번쯤이야  지방간 환자 술 마셨다간   에  이 문제  생길지도,Culture
 뉴스  날씨  내일 찬 바람 불며 기온  뚝  빙판길 주의,Culture
치매 신약  레카네맙  처방 시작 효과와 한계는 ,Culture
이혜원   이것 만 끊어도 날씬해질 듯  얼마나 살찌는 간식이길래 ,Culture
 날씨  중부  한파주의보 서울 체감    도,Culture
 날씨  밤사이 기온 더 떨어져 중부 체감 온도 종일 영하권,Culture
초저가 중국 전기차 공세에  벤츠 삼각별  무너졌다  파산 신청 ,Culture
일요일 서울 체감 영하   도 곳곳 대설주의보,Culture
고깃집에 나오는 명이나물  꼭 먹어야 하는 이유,Culture
 날씨  전국 곳곳 눈 그쳤지만 밤부턴  강추위  온다,Culture
 가슴 수술 후 유두 일부 잃고 죽을 뻔  부작용으로  이 질환 만 세 번 겪은   대 ,Culture
 날씨 내일 체감    도 강추위 전국에 강풍,Culture
 날씨  중부 한파주의보 일요일 서울 체감     도 ,Culture
동짓날 내린 눈에 강원지역서 눈길 사고 잇따라 항공기 결항도 종합 ,Culture
 날씨  찬바람 강해지며 곳곳 영하권 추위   체감온도 영하   도,Culture
작정하고 만든 윤석열 계엄 패러디  극우 댓글에 달린  사이다  반박,Culture
밤에 눈 그치고 추워져요    시뉴스 날씨 ,Culture
강주은  하루 한 번  이 음식  꼭 먹어  노화 예방에 최고 ,Culture
노땅 술     억 투자 받았다  전 세계를 홀딱  이 술의 야심,Culture
한혜진도 이건  짱 이래 하루  분  이것  했너니 놀라운 결과가,Culture
 날씨   동지 에     대설 이어 한파   내일 중부     ,Culture
   가 인정한 몸매    대 브라질    비결은  년간 꾸준히 한  이것   ,Culture
단백질 열풍에  이 식품 까지 듬뿍    너무 많이 먹어 신장 망가지는 경우 ,Culture
 날씨  중부  한파특보  서울 체감    도 강추위,Culture
매생이 전복죽 손바닥문학상 우수상 ,Culture
  시뉴스 날씨  밤까지 곳곳에 눈 내일 아침 기온  뚝 ,Culture
치어리딩 중 목뼈  뚝  의식 잃어    대 여성  무슨 사고였나 보니 ,Culture
유산만     억 남겼다 친구 부인과 불륜  바람둥이 스타 작곡가,Culture
마흔 넘어  간병보호자 가 될 줄 몰랐다,Culture
 날씨  눈 그친 뒤  찬바람   경기 북동부 강원 한파주의보,Culture
하루     명과 자겠다는       명과 관계 뒤 눈물 흘린 이유는 ,Culture
지금  딱   분만  이것  해보세요  통증 사라지고  심혈관 깨끗해져요,Culture
매일  분  계단 오르기  심장마비 위험       효과 얼마나 좋길래   수민이가 궁금해요 ,Culture
 어묵 국물 먹고 싶으면 돈 내세요   컵당    원   인류애 박살  공분,Culture
 배불리 먹고 후식까지 한번에 가능  다시 전성기 맞은 뷔페 무한리필,Culture
 날씨  밤사이 기온 뚝 수도권 초미세먼지  나쁨 ,Culture
멀미할 때 창문 내리고 바람 쐬면 왜 괜찮아질까 ,Culture
목 둘레는       보다 얇고  종아리는     보다 두꺼워야   적정 신체 둘레  체크해보자,Culture
 날씨  눈비 잦아들고 매서운 찬 바람 중부 곳곳 한파주의보,Culture
 기고  기독교인들   부정선거 음모론  무시해야 한다,Culture
 단독   링거줄에 약물흡착돼 약효 떨어져  해묵은 문제에 식약처 대책은  글쎄 ,Culture
 내가 탈모라니  젊은 환자들 급증 이식만이 답일까   건강  ,Culture
 윤석열  이름 가렸던 안유성 셰프  정치적 의도 없다 ,Culture
     김지민       감량 비결    이것  하루 세 번 나눠 먹어 ,Culture
 날씨  내륙 산발적 눈   경기 북동부 강원 한파주의보,Culture
 다이어트 중  이미도   이 음식  먹어  칼로리 조금이라도 줄이려면 ,Culture
 이 음식  많이 먹는 사람  치매 위험     높아,Culture
오락가락 날씨 시달리다 겨울 앞 하얗게 마른 크리스마스 트리  최주연의 스포 주의 ,Culture
      감량  방은희    대에도 내장 지방 없는 비결은  이 운동  ,Culture
 헬스장 갔다와서 성병 걸렸어요  알고보니  이것  때문 ,Culture
 날씨  경기북부 강원 충북북부 한파주의보 낮 체감 영하권,Culture
 날씨  오후까지 곳곳에 눈 본격 찬바람 중부 한파주의보,Culture
 살 안 찌는 이유 있었네  이현이  집밥에  이 음식  한가득  ,Culture
 올해의 작가상  개그맨 고명환  죽을 뻔한 나를 구해준 비법은   인생 막 ,Culture
찐득하고 뻘건 곱창전골  한입 뜨면 속까지 뜨끈하네  김동기 셰프의 한그릇 ,Culture
기이하게도      계엄과 닮았다  망상의 정치  그린 이 영화,Culture
중부     대설 내일은 한파특보 서울 체감    도,Culture
 날씨  강원 충북 대설 이어 한파   오후 눈 그치고 강추위,Culture
 날씨  눈 비 오후에 그쳐 내일 아침기온 영하로  뚝 ,Culture
 죽음 문턱에서   고명환  노벨상 한강과 나란히  대반전   본캐부캐 ,Culture
 날씨  내륙 곳곳 산발적 눈   낮부터 찬 바람 강해져,Culture
   시 날씨  눈비 그치고 기온  뚝  초미세먼지 주의,Culture
 탄핵 응원봉  손에 쥔      여성들 민주주의 새 상징 되었다       ,Culture
 진료는 의사에게   건망증  치매  어떻게 다를까 ,Culture
 쁘레 준비   알레 시작   펜싱 칼 찌르는 재미 너무 좋아요  양종구의    세 시대 건강법 ,Culture
한강  채식주의자  주인공이 앓던 이 병  교양의 재발견 ,Culture
세계  대 보석 컬렉터 아리카와 카즈미  그가 한국에 온 이유는  인터뷰 ,Culture
응원봉 케이팝 가득했던 집회  왜 익숙하냐면요,Culture
 약손   급증하는 자궁내막암 진단과 치료  자궁내막암 전이와 합병증,Culture
분노의 큐시트 성시경이 부릅니다  넌 감동이었어       ,Culture
한라산  최고      넘는 눈 쌓였다 전국 곳곳에 대설주의보,Culture
주말 중부 최대     많은 눈 내일 전국 한파,Culture
 진물 터지고 살 죽어  아이유 앓는  스키터증후군  뭐길래,Culture
 날씨  경기 북동부 강원 한파주의보   낮부터 찬 바람,Culture
 날씨  주말 전국 눈 또는 비 중부 호남 대설 집중,Culture
 민물장어 팔아      억 매출  매장   개 비결은  남돈남산 ,Culture
 멀쩡한 분이 왜 돌연사   이게  숨은 고혈압  전조증상  건강한 가족 ,Culture
 날씨   동짓날  중부 호남 대설 밤사이 기온 급강하,Culture
 미친 거 아냐   죽어가는 연인 만난    대체 뭘 했길래  성수영의 그때 그 사람들 ,Culture
 날씨  강원 충북 전북 경북 대설주의보   오전까지 시간당       눈,Culture
유방암  심장병  요실금까지    잠 좀 못 잤다고 이런 일이 ,Culture
동짓날 전국에 눈 비 찬바람에 기온  뚝 ,Culture
 없어서 못 판다   년 만에 나온     신차 뭐길래  돌풍 ,Culture
긴장하면 주먹 꼭 쥐었던 별사랑의  적당히 내려놓기     터뷰 ,Culture
 유라시아 횡단 도전기       시베리아에서 몽골고원으로 향하다,Culture
 민주화 위해 야수의 마음으로     김재규는 왜 박정희를 쐈나,Culture
강아지 누린내 없애려면 매주 목욕 시켜야 할까   멍멍냥냥 ,Culture
일요일 영하   도  최강 한파  제주도 눈 비 이어져  내일날씨 ,Culture
절기  동지  오후까지 눈비 찬바람에 기온  뚝       날씨 ,Culture
한식당  뉴욕  대 식당이 되다  하재근의 이슈분석 ,Culture
 토요와이드      눈에 중북부 대설주의보 내일은 한파 특보,Culture
혼다 합병설 영향   대만 폭스콘  닛산 인수 보류 ,Culture
당신을 친구보다 더 늙어 보이게 만드는 악습관은 ,Culture
거세된 내시가 일등 신랑감    조선시대 양반가 규수들의 은밀한 셈법은  서울지리지 ,Culture
 날씨  강원 충북 대설주의보   오전까지 시간당       눈,Culture
당뇨병 비만 신약이 효자   내년 상위 매출   개 의약품 중  개 차지 ,Culture
연말 파티에 추천하는  카르파초입니다 주말  ,Culture
 최소  억  값어치 하냐고  무례하긴  롤스로이스야 정우성의 일상과 호사 ,Culture
마른 비만은 근육의 문제다 수피의 헬스 가이드 ,Culture
 핑거이슈  책덕후 가 지은 책을 위한 집  추사재 ,Culture
중부지방 전북동부 강하고 많은 눈  교통안전 유의 ,Culture
동짓날 전국에 눈구름대 오후부터 점차 그쳐,Culture
 침대에선 여자되겠다 는 남자 마초인줄 알았는데 침실서 돌변  사색     ,Culture
 날씨   현재 경기 강원 대설주의보   오후부터 찬 바람,Culture
 겨울에 더 인기인 산    국내 상고대 산행지 베스트  선,Culture
 제주날씨  절기상 동지 찬바람에 기온 뚝  산지엔      눈,Culture
중년 여성들이  꼭  알아야 할 퇴행성관절염과 내반변형,Culture
인조고기 먹는 채식주의자  우울증 위험     더 높다  건강한겨레 ,Culture
양파 썰다가 혼수상태 빠진   양파서 나오는  이것  때문  헬스톡 ,Culture
 타볼레오 베스트셀링 수입     안팎 모두 여유로워졌네,Culture
우유자조금  식물성 대체음료 우유와는 달라 ,Culture
머리 실컷 깨끗이 감아놓고  흔히 저지르는 실수   탈모의 지름길 ,Culture
 현대차 끌어내리자  혼다와 손잡은 일본  위 자동차 닛산에 숨겨진 비밀  추동훈의 흥부전 ,Culture
 동지  전국에 눈 또는 비 눈 그친 일요일엔 영하 추위,Culture
맛은 달콤한데 가격이 살벌하네 딸기 뷔페   명만 가도 가격이 무려,Culture
흑백요리사 만찢남  이제 판타지 요리 웹툰도 그릴 계획       ,Culture
영국사절단  중국 열하 찾아간 이유 결국  아편전쟁 싹이 트다,Culture
 천천히 자라야 크게 자란다     어린이  성장 급행열차 의 함정,Culture
 화이트 동지   강추위에 눈  펑펑   광주 전남       눈,Culture
절기  동지  오후까지 눈비 찬바람에 기온  뚝   주말 날씨 ,Culture
 매년  년씩 늙어    성탄절 앞두고 숨진   세   무슨 병 ,Culture
살과 함께  머리카락 도 빠지기 쉬워   탈모  없이 다이어트하는 법은 ,Culture
 김지수의 인터스텔라  텅 빈 채 그저 달리네  당신이 겪는 그 증상의 이름은  시들함 ,Culture
가족이 모이는 곳에서 내 삶의  맞춤형  공간으로 거실의 진화,Culture
한의약 전립선 질환 치료  알기쉬운 한의약 ,Culture
 에미넴도 화들짝       아부다비  직접 가봤다  권마허의 헬멧 ,Culture
 한동하의 본초여담  사물탕     을 잘 써서    이라 불렸다,Culture
동지에 왜 팥죽 먹을까   이런  사람은 조심해야,Culture
 모던 경성 치솟는 쌀값  구두값   고물가에 신음하는 샐러리맨,Culture
내 혈관 속 시한폭탄의  뇌관      콜레스테롤 잡아라,Culture
 시승기  비 눈길서도 돋보이는  포르셰     카레라 ,Culture
뭣에 쓰는 물건인고  생김새는 망측 씹는 맛은 발칙 음담패설      ,Culture
 시승기   하차감부터 달라  가장 캐딜락다운 전기차  리릭 ,Culture
  대 영희씨의  식욕 부진   체중 감소  정말 스트레스 때문이었을까 ,Culture
 중국 여행 안 간다더니  외국인 관광객  명 중  명  한국인  ,Culture
술 마신 다음날  아아  한 잔  숙취 해소엔  이 음식  드세요,Culture
    년 만의 폭설도 뚫었다  미니 쿠퍼 의 외유내강,Culture
 주말        나이 들수록 줄어드는  이것   영양제로 챙겨야 노화 막는다,Culture
한파에 더 위험    겨울철 고혈압 예방법은 ,Culture
 주당    시간씩 일하라 는 윤석열은  시간 정치  부재 징후였다,Culture
 오늘 날씨  눈 비 내리는 동짓날   미세먼지 마스크 챙기세요 ,Culture
겨울에 더 심해지는 요실금  이것  즐기는 젊은층도 조심,Culture
 오늘의 설교   울림 과  어울림 ,Culture
 가정예배       월   일  가이사의 것과 하나님의 것,Culture
