titles,category
친한계  홍준표  윤석열 탄핵 인용 기정사실화 노욕만 가득 ,Politics
장경태  김건희  계엄 당일 저녁  시간 동안 성형외과 있었다 ,Politics
   러시아 증원 파병 인력 교대 준비 자폭 무인기 지원 정황,Politics
 국힘    복귀 꿈꾸나   내란수사 지연전술  당정 압박하는 민주,Politics
김재원  홍준표 통찰력에 탄복  아웃사이더 아닌 우리당 중심  앙숙   격찬,Politics
마은혁 헌법재판관 후보자 인청 시작 민주    불참에  매우 유감 ,Politics
 단독   대행  탄핵 정족수  대치  국회전문위원     석 적용 적절 ,Politics
 한 번에 탄핵     김어준 유튜브서  장관 줄탄핵  시사,Politics
 속보 이준석  대선출마 시사  단일화 없는  당 당선 경험 이준석 뿐 ,Politics
 시간 끌면 내란 대행  민주  한덕수 권한대행 압박 계속,Politics
 속보  권성동  한덕수 목에  탄핵  칼 들이대고  원하는 대로 안하면 찌르겠다는 민주당 인질극 ,Politics
노종면  국무위원  명 탄핵하면 국무회의 안돌아가 법안 자동발효 ,Politics
어느 정당 지지  민주당     국민의힘       조기 대선  홍준표 유승민 등 여권 잠룡들  꿈틀 ,Politics
이재명  국민의힘에 사과 요구  버티면 내란 없어지나 ,Politics
홍준표 시장  대선출마 시사에   초선  씁쓸    노욕  비판,Politics
이재명  내란동조당 싫다며 내란 동조 행위 버티면 수 나오나 ,Politics
 윤석열은 최악의 술통령   역대 대통령들은 어땠길래,Politics
대만해협 중간선 신경전 가열  무력분쟁  경고음 잇따라,Politics
 김건희 특검  두려운 국힘   한덕수 탄핵  대통령 탄핵 절차 밟아야 ,Politics
홍준표  대구 떠날 생각에 뒤숭숭   박정훈  벌써 마음은 콩밭에  추한 노욕 ,Politics
 무등의 아침   민주당  한덕수에 최후통첩 국힘  대선시계 늦추기 올인 ,Politics
 측 석동현 변호사  내란죄 부인했다고 고발  이재명 맞고소 ,Politics
박정훈  진심은 없고 노욕만 가득  홍준표 또  직격 ,Politics
권성동    당리당략 위해   인 헌재  고수  이제와 임명하자  ,Politics
박선원    골프는  내란 준비용  북풍공작 안 되자 작전계획 가다듬어 ,Politics
 대한민국 모든 세대가 윤석열에게 등 돌렸다   월간중앙 ,Politics
천하람  윤석열은 방구석 여포 법꾸라지 행태로 스스로 망쳐 ,Politics
 바다의 탑건  최우수 전투함에 천안함 선정,Politics
 말말말  김한규  대통령 대처 의심스러워  서지영  야  조급해 보여  이준석  분뇨차 누구  ,Politics
권성동  민주당  한 대행 목에  탄핵 칼  원하는대로 안하면 찌르겠단 인질극 ,Politics
  대행 탄핵       역풍   전문가들     점령군  발언 우려  뉴스캐비닛 ,Politics
   장관 줄탄핵 시사      명 탄핵시 법안 의결 못해  자동 발효 ,Politics
안철수  비대위원장  충청권 의원 맡아야  나는 전혀 생각 없어 ,Politics
권성동    겨냥  탄핵했어야 할 총리에게 대통령 권한 맡겼나 넌센스 ,Politics
이재명  국민  위기 극복 위해 광화문행 여당은 목소리 안 들리는 듯 ,Politics
박정훈  홍준표 직격  대구시정 마음 떴다고 스스로 선언 정말 노답 ,Politics
권성동  민주   한덕수 탄핵 인질극  난센스 ,Politics
야당 단독으로 열린 헌법재판관 청문회  인 체제 만들어지나,Politics
 뉴스퀘어    윤  일주일째  수취 거부    헌법재판소 입장은 ,Politics
안철수  비대위원장  수도권 친윤 색채 옅은 사람이 돼야 ,Politics
권성동    국무총리 탄핵이라는 칼을 목에 들이대고 원하는 대로 하지 않으면 찌르겠다는 탄핵 인질극 ,Politics
여  야당의 일방적 헌법재판관 임명 추진은 위헌 권한쟁의심판 대상  종합 ,Politics
  년생 국힘 전 비대위원  아이유  탄핵집회 후원   진심으로 슬펐다 ,Politics
이준석  조기 대선 겨냥      년 이후 단일화 없는  당 당선자는 이준석 뿐 ,Politics
노상원  윤 대통령 올해 운 트여  정작 본인은 구속 천하람  계엄 쿠데타 본부가 점집 ,Politics
황교안  선관위  이재명 유죄판결 예상은 아예 안 하나 ,Politics
 현장연결  이재명    특검 반대 시간끌기  더 큰 책임 불러올 것 ,Politics
안보 강조했던 윤석열  대북 정보부대는 초토화됐다,Politics
홍준표  틀딱 유튜브 사라져야 가짜뉴스 진원지 ,Politics
윤상현  트랙터 시위 충격 공권력 무너뜨린 난동 세력엔 몽둥이가 답 ,Politics
 북한군  우크라전에서 수백명 사상하고도 인해전술 고집 ,Politics
   최상목 부총리에  국회 운영비 끊어라  지시 정황,Politics
  비대위원장 권영세 나경원 물망에 권성동은  원톱   이런정치 ,Politics
권성동  칼 들이대고 인질극   한덕수 탄핵 추진  민주당 비판,Politics
  중공업 신형 고속정  척 수주 함정 건조 기술력 인정,Politics
 정치쇼  천하람    재판 지연  변호인단 섭외 정말 안 된다더라 ,Politics
 동크 수로포비치  된 리대혁  위장 신분 북한군  한글 써 들통,Politics
헌법재판관 후보자 청문회 시작    선례 입각해 임명     권한쟁의심판 제기  이런정치 ,Politics
권성동     총리 탄핵 칼을 권한대행에 들이대며 탄핵인질극 ,Politics
안철수  어차피 대통령 이재명    탄핵 후 범죄자 대통령 뽑겠나 ,Politics
 전격시사  김성태 국민의힘 전 의원   홍익표 더불어민주당 전 의원        특검법 공포 않으면 책임 물을 것  의견은  ,Politics
안철수  비대위원장   영남 친윤 극우 에서 자유로운 사람 돼야 ,Politics
   싸움에 등터지는 한덕수  정치 문제는 정치인들끼리   용산실록 ,Politics
 전격시사  서지영 국민의힘 원내대변인    국민의힘   투톱체제  되나   비대위원장  조건 은 ,Politics
  년 전 피격사건 딛고 올해  바다의 탑건 에 천안함,Politics
검찰   계엄 전 국무회의 배석  조태용 국정원장 비공개 조사,Politics
 이번 주 내에 끝내겠다  민주당   국민의 힘이 사용할 카드는    녹취록 ,Politics
권성동  한덕수 탄핵도 국회  분의   동의 있어야 ,Politics
국민의힘  한 대행 탄핵 절차 대통령 준해야   가결정족    석론  강조,Politics
권한대행 탄핵  헌법재판관 임명 여야 공방 지속,Politics
권성동  한덕수 탄핵하려면 대통령 준하는 절차 밟아야 ,Politics
대한민국 빙하시대  국민은 포기하지 않는다,Politics
권성동  민주당  한덕수 총리  탄핵안은 탄핵 인질극 ,Politics
박선원  윤통 골프  외교용 아닌 내란용 특전사    과 계엄 계획 다지기 ,Politics
   멘토  신평   간신  비난에 발끈  공직 맡은 적 없어 ,Politics
 김기현 권영세 나경원    비대위원장 후보에 안철수  다른 사람 또 나와야 ,Politics
공조본  윤석열 통화 내역 확보    조사 불응 첫 번째 강제 수사,Politics
이상민    멸문지화 뻔한데 딴전 천막당사 치고 민심 받들자 ,Politics
 아이유 진심 슬퍼     년생  국민의힘 전 비대위원,Politics
김근식 박수현  계엄 핵심이 햄버거 보살  참담해 ,Politics
 뉴스초점  특검법 충돌 야  내일까지 공포     여  국정 마비 ,Politics
이준석   이재명은 분뇨차  한 적 없다  왜 화를 한덕수  전쟁 나도  눈치  ,Politics
김부선  재명이가 대통령 되면 윤석열처럼 계엄령 때리겠냐 ,Politics
 정치시그널 인터뷰 전문 조경태  지금이라도 내란 김 여사 특검 독소조항 빼고 발의해야 ,Politics
안철수  비대위원장 안 맡을 것 친윤 색채 없는 의원이었으면 ,Politics
 현장연결  국민의힘 원내대책회의 현안 관련 입장 설명,Politics
 정치쇼  김한규  한덕수  헌법재판관 임명 거부시 더 중한 탄핵사유 ,Politics
안철수  한덕수  내란특검법에 거부권 행사 안돼 ,Politics
  김한규  한덕수  헌법재판관 임명  사인할 것으로 본다 ,Politics
 뉴스     대통령 폰  들여다본 공조본   성탄절 대면조사는 ,Politics
   일까지 쌍특검 공포 안하면 탄핵  고민 깊어지는 한덕수,Politics
 무속 정치 의 처참한 종말 김종구의 새벽에 문득 ,Politics
국수본  윤석열  개인폰  통화 내역 확보  내란 비선  통화 밝혀질까 ,Politics
우원식 리더십 여야 극한대치 속에도  중립  헌법 현장 좇는 협치주의자             ,Politics
비상계엄 반대했지만 탄핵 쓰나미에 밀려난 한동훈,Politics
   러시아 파병 대가로  재활용 전투기  받나,Politics
대권 노리는 홍준표  또 이사 가야한단 생각에 뒤숭숭 ,Politics
 대선 출마  시사 홍준표  대구시장 졸업 시기 빨라질 수 있단 생각 ,Politics
      올해의 정치 인물  아내 빼고 다 쳐낸  뺄셈정치   계엄 자해극  몰락 자초한  ,Politics
 아이유 정치색 안 드러냈었는데    국힘 비대위원  아쉬움 토로,Politics
 이재명은 안됩니다  현수막 논란 선관위   불허  재논의,Politics
경찰    통화내역 확보 오늘부터 헌법재판관 청문회 뉴스쏙 속 ,Politics
대권 도전 시사 홍준표  돌고 돌아 제자리로 왔다고 생각했는데 또 이사가야 하나 아수라판 조속히 정리되었으면 ,Politics
  박은식  아이유  이전에는 정치색 안 드러냈는데 진심으로 슬펐다 ,Politics
박선원    골프  외교용 아닌  내란용  특전사    과 계엄 계획 다지기 ,Politics
 뉴스    윤  탄핵서류  미수령   헌재   송달간주  처리하나 ,Politics
이준석  분뇨차  이재명 긁혔나   제 지대 승리는 이준석뿐 ,Politics
계엄 때 맨몸으로 군용차 막은 시민  이재명  꼭 찾아 달라 ,Politics
 원톱    투톱   국힘  비대위원장 두고 고심   도로 친윤당  우려도,Politics
국힘 비대위원장  돌고 돌아 고심끝에 권성동     많은 의원들이 원톱 낫다고 ,Politics
우크라군  북한군 신분증에 러시아 이름 한글 서명에 들통 ,Politics
 국회 마비 아냐 라던 윤석열   국회 운영비 끊어라  지시한 쪽지 나왔다,Politics
유승민  민주당에 경고  정권 다 잡은 듯 행동 말라 ,Politics
 뉴스돋보기  탄핵 카드로 한덕수 압박하는 야당 특검 폭거라는 여당,Politics
 아이유  진심 슬펐다   광주 국힘  내과의사  아쉬움 토로   왜 ,Politics
 윤통 비난 도저히 못 참아  홍준표도     신고당했다,Politics
퇴직연금 깨서 노후 불안하지 않게 중도인출 요건 강화 추진,Politics
공조본    개인 통화내역 분석  최상목 하달 문건 도 확보,Politics
안철수  이원집정부제  그럼 대통령은    총리는 이재명인데 돌아가겠나 ,Politics
윤 탄핵심판 드러나는 대진표 진보 보수  창과 방패  집결,Politics
한동훈 주춤  홍준표 이준석 기지개 보수 잠룡들 미래는 ,Politics
 아이유 정치색 안 드러냈었는데    국힘 비대위원  한숨 ,Politics
  샅샅이 감시할 정찰위성  개발부터 발사까지,Politics
홍준표  명태균 따위 놀아나지 않아 큰 사고 칠 줄 알았다 ,Politics
 여의뷰 빨라지는 대선 시계   불신의 늪  빠진 개혁신당,Politics
탄핵심판 서류 송달했지만    묵묵부답  헌재 입장 밝힌다,Politics
 이재명은 안 돼  선관위가 막은 문구  일파만파    결국 재논의,Politics
   일까지 특검 수용  최후통첩  국정 초토화 ,Politics
윤 대통령  버티기  전략 언제까지 성탄절 공수처 출석 가능성은 ,Politics
 내일까지 공포하라   탄핵 추진  최후통첩,Politics
 재명아 감방가자      이재명은 안됩니다      선관위 현수막 문구 제재 논란,Politics
공조본    개인전화 통화내역 확보,Politics
윤석열 없는  윤석열 정부  외교 어떡해 ,Politics
계엄의 밤  숨겨진 진실 밝혀라,Politics
 내란의 밤   시간 전 그들은 휴가까지 내서 판교에 모였다,Politics
싹트는    관계     비핵화 패싱 은 막아야  밀리터리 월드 ,Politics
  대비태세발령 어떻게  데프콘    워치콘    인포콘    진도개  단계별 의미 이현호 기자의 밀리터리 톡 ,Politics
   새 밀월관계로 핵 군축가는 재앙만은 막아야      년   전략은 밀리터리 월드 ,Politics
 월의 장미대선  미리 보는  대진표 ,Politics
    탄핵정국 반복   여야정협의체 실패 특검 갈등 권한대행 탄핵될까,Politics
  쪽   탄핵안 주도 김용민  헌재 결정   월 초 전에 끝내야  인터뷰 ,Politics
  비대위원장 막판 고심  투톱이냐 원톱이냐  의견 다양,Politics
야  한덕수 탄핵  시동  국힘     표 필요  방어,Politics
신평    품성 선해 헌재서 살아오면 훌륭한 지도자 될 것 ,Politics
 권한쟁의 심판 까지  법잘알   지도부의 시간끌기,Politics
여야 특검 충돌    일까지 공포해야      거부권 안 쓰면 헌법 위반 ,Politics
 내란 잔불 진압   속도전  국정안정 은 딜레마,Politics
 육사 충암고 대전 출신  학연 지연 총동원  계엄  인방  전원 구속,Politics
공수처 소환 헌재 심판  운명의 한 주  맞은 윤 대통령,Politics
   정찰위성  호기 발사 성공    동향 더 촘촘하게 감시한다,Politics
반복된 인물난 속 원톱  투톱     비대위원장   일쯤 윤곽,Politics
단톡방 의총 녹취 유출된     악마의 편집  뭇매 맞는 친한,Politics
이재명  의인 찾아 달라   그날 맨몸으로 맞선 여의도 군용차맨,Politics
      때   경비단 모임처럼      내란 땐    여단이 배후기지,Politics
국면마다  주판알  튕기나 한덕수  성탄절 분수령 ,Politics
안철수    년 체제  국민 둘로 쪼개 선거법만 바꿔도 해결    포스트    길을 묻다 ,Politics
국힘 비명이 친명을 포위했다 개헌론 두고 복잡해진 관계,Politics
  성 장군 탈락에 꼭지 돌았다  김용현 권력 집착 불붙인 사건,Politics
야당의 최후통첩   일 국무회의  한덕수의 선택은,Politics
부패 찌든 중국군     중 핵탄두    개      년엔     개   밀리터리 브리핑 ,Politics
 자우림   방사림 으로 이름 바꿔라    전여옥   서 콘서트 김윤아에 맹폭,Politics
 부정선거  주장    감사원 국정원 검찰로도 안되자    결국 계엄군 투입,Politics
   너마저도  비상계엄 후폭풍에 곤두박질    지지율 ,Politics
계엄 배후에  불명예 전역  민간인들    헌병 수사단장도 연루,Politics
    법적 책임 회피 않겠다더니  법 악용해 탄핵심판 고의 지연 ,Politics
   내란 김건희 특검법   대행 내일까지 공포를 ,Politics
한동훈 독주 깨지자  여권 대선판  리셋 ,Politics
 이재명 안된다  현수막 불허 논란 커지자  선관위  오늘 재논의,Politics
세계는 줄줄이 트럼프와 정상회담  한국은  정용진     이 유일,Politics
계엄  여사 계속 이슈화해 지지층 결집 노려,Politics
초유의 대행 탄핵 예고     탄핵시계 앞당기기  올인하는  ,Politics
국민의힘 비대위원장 논의 하세월 크리스마스 이브엔 발표될까,Politics
국힘 비대위 원톱이냐 투톱이냐 권성동의 선택은 ,Politics
선관위    의원 내란공범  현수막 허용  이재명은 안돼 ,Politics
 이러니 부정 의심받는다  선관위 때리기 팔 걷은  ,Politics
 중앙 에 꽂힌 시선 존재감 드러내는 범여권 대권 잠룡,Politics
보수층도 등 돌린  도로 친윤당    수도권 중심 재편해야 ,Politics
여야  특검법 줄다리기   여야정 협의체도 삐걱,Politics
경찰    개인 통화내역 분석 최상목  하달 문건 도 확보 종합 ,Politics
 스트레이트  퇴행과 절망  그리고 반전     년의 기록,Politics
국민의힘 텔레그램 대화 의총 녹취록 공개 파문 배후는 친한계 ,Politics
민심 등진 국민의힘  분열 속 쇄신 실종  영남 자민련  되나,Politics
계엄 배후에  불명예 전역  예비역들 선관위 장악 설계도까지 그린 정황,Politics
트럼프 만난 정용진  여러 주제   분 대화 ,Politics
   멘토  신평  내가 간신  공직 맡은 적 없고  에 쓴소리 간신 될 자격 없어 ,Politics
탄핵 경고받은 한덕수  내란 김건희 특검    일까지 결정 어렵다 ,Politics
   일까지 특검 수용하라  최후통첩  탄핵소추 협박은 국정 초토화 ,Politics
 단독   정보사령관 바꾸려다 국방장관이 날아가 김용현 투입이 계엄 출발점 ,Politics
여당 비대위  이번 주 초 결정    권성동 원톱 의견 여전 ,Politics
크리스마스 전에 한덕수 응답하라       일까지 특검 거부하면 탄핵 ,Politics
탱크부대장  계엄 당일   차 롯데리아 회동 에 참석했다,Politics
 여랑야랑 돌아가자  청와대로    쓰레기차와 분뇨차   동상이몽,Politics
 이재명 고소할 것    옹호 석동현 변호사  민주당과 맞불 예고,Politics
정동영 의원  내란죄보다 더 심각한 외환죄 ,Politics
 뉴스추적  양보 없는 여야 탄핵 기로선 한덕수,Politics
 인터뷰  천하람  윤  법꾸라지  행태  다 대응 전략 있다 오히려 본인이 망치고 있는 꼴 ,Politics
조기대선 치르면  어대명   여야 잠룡들 잰걸음,Politics
한동훈 사퇴  주  권성동 원톱    투톱  정리도 못한  ,Politics
 잠룡들 기지개 홍준표  탄핵반대  오세훈  탄핵찬성  유승민  쇄신론 ,Politics
 에  최후통첩  보낸 공수처  체포영장도 고려 불안정  공조 수사  우려도,Politics
 잘못은  이 사과는 내가  억울하고 참담  사과 현수막 건 김근식,Politics
신원식이 결정한  문상호 직무배제  김용현 장관된 뒤 뒤집혀,Politics
유승민    경선부터 위험 본인 말한  저항권 의 심판받는중 ,Politics
  잠룡들  꿈틀    오세훈 홍준표    때리기 ,Politics
 여용사    단체방에 뜬  광화문 집회 ,Politics
고해상 위성 군집 운용  촘촘해진 대북 감시망,Politics
 비대위원장 일주일째 난항 일각 유승민 등판론에 주류 선긋기 종합 ,Politics
이재명 판 깔아준다     여야정협의체 출범 전부터  동상이몽 ,Politics
 한동훈에 감사  표명한 함운경    계엄 찬성파   자유 아닌  냉전 보수 ,Politics
 단독   사조직 집결  들통날라 정보사  계엄 날 비상소집   분만에 해제,Politics
일주일 넘도록    일 의총 에 갇힌 여당 녹취록에 계파갈등 격화,Politics
올해 남은 국무회의는  번  내란 김여사 특검법  쥔 한덕수의 선택은 ,Politics
한덕수 측  결정 쉽지 않다   특검법 결론 더 미룰 듯      에 특검법 압박 ,Politics
     탄핵 무기로  정국 방향키 잡기    는  버티기 전략       에 특검법 압박 ,Politics
 아스팔트 보수  기대 소나기 피하려는    소탐대실 비판도,Politics
 잠룡들 움직임  분주   이재명 견제 부터  자성론 까지,Politics
   일까지 특검 안되면 한덕수 탄핵   압박 뒤엔  공수처 불신 ,Politics
 단독   육사 카르텔 이 장악한 정보사  지휘관 따돌리고 내란 주도,Politics
헌법재판관 후보자  인   대통령 권한대행이 임명 가능  공통 의견,Politics
이재명  대권가도 신중 관리    먼저 대선 말하면 오만 ,Politics
 잠룡들 탐색전 홍준표 오세훈    때리기  유승민  쇄신론 ,Politics
이재명 참여가 관건  여야  협의체 출범 앞두고  신경전 ,Politics
선관위   국힘 내란 공범  허용  이재명 안 된다  불허 논란,Politics
홍준표  틀딱 유튜버 사라져야 사람들 현혹해 거짓 선동 ,Politics
군용차 막아선  맨몸 의인 에 이재명  이분 꼭 찾아 달라 ,Politics
야당 압박에 또 고민 깊어진 한덕수,Politics
남태령 트랙터 막은 경찰  존재 이유 묻지 않을 수 없다,Politics
여  국정 마비     야  지장 없어   내란 김 여사 특검법 정면 충돌,Politics
한동훈 지고 홍준표 유승민 반등   지각변동  보수 잠룡  경쟁력은,Politics
   비대위원장 인선 막판 진통      투톱체제  유력,Politics
    대행 탄핵    일 데드라인        국정 초토화 불사한 겁박 ,Politics
박선원  강호필 지작사령관  김용현 주재 계엄 화상회의 참석 ,Politics
   한덕수에  대요구   데드라인 앞당기며  탄핵 속도전,Politics
 쌍특검  거부권 안 쓰면 위헌   거부땐 탄핵   에 공 넘기는   ,Politics
안산보살 전과자 집사 이런 민간인들에게 비상계엄 맡겼다,Politics
 이준석 조기대선 플랜 에 개혁신당 때아닌 내홍,Politics
한양대 의대 수시 합격해놓고  초유의 사태  벌어졌다,Politics
여론이냐 진영 논리냐    비대위장 특검 헌재   중 딜레마 ,Politics
민주  내란 김건희 특검   일까지 공포하라  한덕수 탄핵 최후통첩,Politics
 이재명은 안됩니다      국민의힘 의원 은  내란공범       이러니 선관위 부정선거 의심 ,Politics
 북한엔 이런 거 없지     시간 우주에서  감시  정찰위성  호기 발사 영상 ,Politics
수렁 빠진 국민의힘  유승민 구원등판 가능할까,Politics
공수처  윤 대통령  내란 혐의  소환 이번 주      일  주요 일정,Politics
  두 체제  국정협의체 여야  이재명 참여 두고 기싸움 종합 ,Politics
국민의힘  쇄신 골든타임 놓치고  영남 자민련  되나,Politics
유승민  윤 대통령 감싸면 망하는 길 한동훈 리더십 부족 ,Politics
  조 체코 원전수출 최종 계약 흔들리면 어쩌나,Politics
계엄 핵심  육사  인방  충암파 대전파로 거침 없었지만 모두 구속,Politics
여야정협의체 시작부터  삐걱  주도권 다툼   탄핵 등 난항 예고,Politics
    이재명 안된다  현수막 불허  편파적  선관위  내일 회의 종합 ,Politics
특검법 정면충돌    모레까지 공포하라     국정마비 속셈 ,Politics
민주  한덕수 시간표에 끌려다닐 수 없다  탄핵 압박,Politics
혁신당  한덕수 탄핵안 공개  내란세력 제압에 가장 큰 걸림돌 ,Politics
의총 녹취까지 유출된 국힘  심리적 분당     석 무너졌나  우려 ,Politics
이상민  국민의힘 향해  천막당사 치자 ,Politics
 쥐   이기주의자     자성모드   년 전과 다른 이유 ,Politics
한덕수  특검  헌법대로       탄핵 압박에도 거부권 행사 장담 못 해,Politics
나경원  이러니 부정선거로 의심  선관위 형평성 비판,Politics
   일까지 내란 김여사 특검 공포      국정 여당 마비 속셈 ,Politics
민주당    체포 시 대통령실 경호처 저항하면 한덕수 책임 ,Politics
이재명 지지율      유보층도      중도층 아직   의심 ,Politics
  헌법재판관 임명 속도전에    대통령 권한대행에 권한 없어 ,Politics
 이재명 안 된다  현수막 불허 국힘  선관위가   선거운동 ,Politics
 내란 수사  검 경   정치인 선관위 체포조  규명에 힘 쏟는 이유는,Politics
초선부터  선까지  투톱  맞다는데 권성동  원톱 좋단 의원들 많아 ,Politics
민주당이 한덕수 못 믿는 이유  상설특검도 안 하는데 ,Politics
국힘 김근식  잘못은  이 했는데 사과는 내가 억울해 ,Politics
 특검 승인 헌재 구성 완수하라    민주당  한덕수 탄핵버튼 누를까,Politics
조기 대선 출마 시동거는 홍준표  이번엔 다를 것 범죄 난동범 이재명이라 다행   지역 이슈 ,Politics
특검법 거부하라는      탄핵 고리로 특검법 공포하라는  ,Politics
 민생 문제 시급한데     여야  국정안정협의체 구성 두고 신경전,Politics
민주 내란진상조사단  한덕수  윤 체포 동의해야 안 하면 탄핵 버튼 ,Politics
  탄핵안 쓴 김용민    전 대통령 때와 차원이 달라  인터뷰 ,Politics
 년전 했던 말 뒤집는 권성동  권한대행  헌법재판관 임명 안돼 ,Politics
유승민  국민의힘  완전히 망하는 코스로 가고 있다 ,Politics
   내일부터   파면  비상행동  대행 겨냥 탄핵 압박,Politics
내일부터 헌법재판관 인사청문회   속도전에   임명 불가,Politics
홍준표  가짜뉴스 진원지  틀딱 유튜브 사라져야 ,Politics
 전투력  나경원   안정감  권영세    비대위원장 설왕설래,Politics
    러에 컨테이너  만개 넘겨  트럼프 귀환 전 바짝 불량거래 ,Politics
선관위 잣대 편파성 논란  내란 공범 은 되고  이재명은 안 된다 ,Politics
국민의힘 비대위  투톱  가닥   친윤 딜레마는 여전,Politics
기자  거부권 되고 재판관 임명 안돼  모순 아니냐  권성동 답변은,Politics
 정찰위성  호기 정상궤도 진입 김정은 집무실  시간 마다 본다,Politics
차기 대통령 선호도 압도적 선두 이재명 마냥 웃지 못하는 이유는 ,Politics
남북  위성감시망 전쟁  격화    정찰위성  호기 성공,Politics
